Order ID,Product Name,Discount,Sales,Profit,Quantity,Category,Sub-Category
AZ-2013-9453292,"Okidata Receipt Printer, Durable",0,$615.00,$25.00,5,Technology,Machines
AZ-2013-706916,"Elite Letter Opener, High Speed",0,$53.00,$22.00,2,Office Supplies,Supplies
AZ-2013-2465655,"Avery 3-Hole Punch, Recycled",0,$85.00,$0.00,3,Office Supplies,Binders
BN-2013-48132,"Hon Executive Leather Armchair, Red",0.2,$735.00,-$184.00,2,Furniture,Chairs
AZ-2013-4775573,"Stanley Markers, Easy-Erase",0,$45.00,$0.00,2,Office Supplies,Art
AZ-2013-4775573,"GlobeWeis Clasp Envelope, with clear poly window",0,$13.00,$5.00,1,Office Supplies,Envelopes
AZ-2013-4775573,"Fiskars Ruler, High Speed",0,$29.00,$0.00,2,Office Supplies,Supplies
AZ-2013-9231004,"Ibico Binder, Clear",0,$45.00,$4.00,3,Office Supplies,Binders
AZ-2013-5022500,"BIC Pencil Sharpener, Fluorescent",0,$212.00,$72.00,7,Office Supplies,Art
AZ-2013-5022500,"Binney & Smith Markers, Fluorescent",0,$76.00,$21.00,3,Office Supplies,Art
AZ-2013-6415803,"Eldon Trays, Blue",0.1,$173.00,$15.00,4,Office Supplies,Storage
AZ-2013-3807660,"Elite Scissors, Easy Grip",0,$24.00,$11.00,1,Office Supplies,Supplies
AZ-2013-5022500,"Logitech Numeric Keypad, Bluetooth",0,$278.00,$42.00,6,Technology,Accessories
AZ-2013-7749449,"Enermax Note Cards, Multicolor",0,$98.00,$21.00,3,Office Supplies,Paper
BN-2013-583958,"Bevis Training Table, Adjustable Height",0.35,"$1,096.00",-$422.00,5,Furniture,Tables
AZ-2013-4637331,"Green Bar Note Cards, Multicolor",0,$34.00,$14.00,1,Office Supplies,Paper
AZ-2013-7626927,"Eldon Door Stop, Black",0,$602.00,$114.00,12,Furniture,Furnishings
AZ-2013-7626927,"Boston Sketch Pad, Fluorescent",0,$648.00,$0.00,13,Office Supplies,Art
AZ-2013-7626927,"Cardinal Binder Covers, Clear",0,$34.00,$9.00,3,Office Supplies,Binders
AZ-2013-7626927,"Apple Speaker Phone, with Caller ID",0.15,$734.00,$86.00,7,Technology,Phones
AZ-2013-125479,"Harbour Creations Steel Folding Chair, Red",0.1,$264.00,$50.00,3,Furniture,Chairs
AZ-2013-125479,"Tenex Light Bulb, Erganomic",0,$18.00,$1.00,1,Furniture,Furnishings
AZ-2013-125479,"GlobeWeis Peel and Seal, Set of 50",0,$43.00,$0.00,2,Office Supplies,Envelopes
AZ-2013-3367178,"Sanford Markers, Water Color",0,$370.00,$33.00,14,Office Supplies,Art
AZ-2013-8617478,"Novimex Chairmat, Red",0,$225.00,$68.00,4,Furniture,Chairs
AZ-2013-8617478,"Avery Legal Exhibit Labels, Laser Printer Compatible",0,$11.00,$2.00,1,Office Supplies,Labels
AZ-2013-9258078,"Binney & Smith Pens, Easy-Erase",0.5,$24.00,-$24.00,4,Office Supplies,Art
AZ-2013-9673280,"Binney & Smith Sketch Pad, Easy-Erase",0,$186.00,$28.00,4,Office Supplies,Art
BN-2013-9375572,"Hoover Stove, White",0.5,"$3,400.00","-$3,060.00",12,Office Supplies,Appliances
AZ-2013-8057502,"Hewlett Copy Machine, Laser",0,"$1,580.00",$32.00,6,Technology,Copiers
AZ-2013-3627184,"Xerox Message Books, Recycled",0,$61.00,$19.00,3,Office Supplies,Paper
AZ-2013-7994697,"Boston Pens, Fluorescent",0,$31.00,$5.00,2,Office Supplies,Art
AZ-2013-7994697,"Canon Fax Machine, Digital",0,$954.00,$219.00,3,Technology,Copiers
AZ-2013-360970,"Harbour Creations File Folder Labels, Laser Printer Compatible",0,$70.00,$22.00,8,Office Supplies,Labels
AZ-2013-3156209,"Deflect-O Frame, Black",0.3,$231.00,$46.00,3,Furniture,Furnishings
AZ-2013-3156209,"Binney & Smith Markers, Fluorescent",0,$127.00,$34.00,5,Office Supplies,Art
AZ-2013-3156209,"Acco Hole Reinforcements, Clear",0,$12.00,$0.00,2,Office Supplies,Binders
AZ-2013-3156209,"Green Bar Parchment Paper, 8.5 x 11",0,$104.00,$43.00,5,Office Supplies,Paper
AZ-2013-699098,"Nokia Smart Phone, Cordless",0.15,"$1,622.00",$324.00,3,Technology,Phones
AZ-2013-4362020,"Avery Binder Covers, Clear",0,$63.00,$14.00,6,Office Supplies,Binders
AZ-2013-3983168,"Hon Bag Chairs, Set of Two",0.5,$71.00,-$54.00,3,Furniture,Chairs
BN-2013-2153787,"Advantus Light Bulb, Black",0.6,$72.00,-$24.00,9,Furniture,Furnishings
AZ-2013-3983168,"Avery 3-Hole Punch, Durable",0.5,$88.00,-$27.00,6,Office Supplies,Binders
AZ-2013-3983168,"Wilson Jones Binding Machine, Durable",0.5,$126.00,-$121.00,5,Office Supplies,Binders
AZ-2013-3983168,"GlobeWeis Manila Envelope, Set of 50",0.5,$27.00,-$9.00,2,Office Supplies,Envelopes
BN-2013-2153787,"Harbour Creations Color Coded Labels, 5000 Label Set",0.5,$20.00,-$1.00,3,Office Supplies,Labels
AZ-2013-3983168,"Konica Card Printer, Wireless",0.5,$613.00,-$343.00,7,Technology,Machines
AZ-2013-2134224,"Dania Floating Shelf Set, Metal",0.1,$152.00,$47.00,1,Furniture,Bookcases
AZ-2013-2134224,"Fellowes Box, Blue",0.1,$124.00,$8.00,7,Office Supplies,Storage
AZ-2013-9907,"Eldon Light Bulb, Black",0,$50.00,$19.00,2,Furniture,Furnishings
AZ-2013-9907,"Sanford Markers, Blue",0,$93.00,$18.00,4,Office Supplies,Art
AZ-2013-9907,"Ames Interoffice Envelope, Recycled",0,$132.00,$59.00,3,Office Supplies,Envelopes
AZ-2013-6711717,"Deflect-O Frame, Durable",0,$214.00,$88.00,2,Furniture,Furnishings
AZ-2013-6711717,"BIC Markers, Blue",0,$132.00,$3.00,5,Office Supplies,Art
AZ-2013-6711717,"Boston Markers, Blue",0,$79.00,$32.00,3,Office Supplies,Art
AZ-2013-3088636,"Binney & Smith Highlighters, Fluorescent",0,$36.00,$3.00,2,Office Supplies,Art
AZ-2013-9938365,"Rubbermaid Photo Frame, Erganomic",0,$101.00,$31.00,2,Furniture,Furnishings
AZ-2013-9827479,"Green Bar Cards & Envelopes, 8.5 x 11",0,$105.00,$19.00,2,Office Supplies,Paper
AZ-2013-2678161,"Avery Index Tab, Durable",0,$33.00,$9.00,5,Office Supplies,Binders
AZ-2013-2678161,"Fiskars Scissors, High Speed",0,$116.00,$56.00,5,Office Supplies,Supplies
AZ-2013-7710840,"Binney & Smith Pens, Water Color",0,$30.00,$11.00,2,Office Supplies,Art
AZ-2013-7710840,"Avery Binder Covers, Clear",0,$11.00,$2.00,1,Office Supplies,Binders
BN-2013-6837899,"Cuisinart Coffee Grinder, White",0.1,$165.00,$57.00,5,Office Supplies,Appliances
BN-2013-6837899,"Wilson Jones Binding Machine, Recycled",0,$49.00,$5.00,1,Office Supplies,Binders
BN-2013-6837899,"Stockwell Staples, Bulk Pack",0,$31.00,$13.00,3,Office Supplies,Fasteners
BN-2013-6837899,"Kleencut Ruler, Serrated",0,$41.00,$10.00,4,Office Supplies,Supplies
BN-2013-441704,"Sauder Library with Doors, Metal",0.5,$581.00,-$198.00,3,Furniture,Bookcases
BN-2013-441704,"Advantus Photo Frame, Durable",0.2,$120.00,-$6.00,3,Furniture,Furnishings
BN-2013-441704,"Tenex Photo Frame, Duo Pack",0.2,$249.00,$84.00,6,Furniture,Furnishings
AZ-2013-6802973,"Hamilton Beach Refrigerator, Black",0.1,$899.00,$80.00,2,Office Supplies,Appliances
BN-2013-441704,"BIC Canvas, Fluorescent",0.5,$137.00,-$41.00,5,Office Supplies,Art
BN-2013-441704,"Sanford Pens, Blue",0.5,$11.00,-$6.00,2,Office Supplies,Art
BN-2013-441704,"Cardinal Binder Covers, Economy",0.5,$12.00,-$11.00,2,Office Supplies,Binders
AZ-2013-9545933,"Sanford Pens, Easy-Erase",0,$34.00,$8.00,3,Office Supplies,Art
BN-2013-441704,"Logitech Keyboard, Bluetooth",0.5,$72.00,-$58.00,2,Technology,Accessories
AZ-2013-3483098,"Harbour Creations Chairmat, Black",0,$278.00,$58.00,4,Furniture,Chairs
AZ-2013-3483098,"Cameo Peel and Seal, with clear poly window",0,$74.00,$32.00,3,Office Supplies,Envelopes
AZ-2013-3483098,"Cisco Signal Booster, Full Size",0,$153.00,$5.00,1,Technology,Phones
AZ-2013-4468276,"BIC Pencil Sharpener, Fluorescent",0,$242.00,$82.00,8,Office Supplies,Art
AZ-2013-6138648,"Office Star Rocking Chair, Adjustable",0.1,"$1,032.00",$298.00,8,Furniture,Chairs
AZ-2013-6138648,"Rubbermaid Photo Frame, Erganomic",0,$151.00,$47.00,3,Furniture,Furnishings
AZ-2013-6138648,"Binney & Smith Sketch Pad, Blue",0,$185.00,$48.00,4,Office Supplies,Art
AZ-2013-2709620,"Binney & Smith Markers, Fluorescent",0,$76.00,$21.00,3,Office Supplies,Art
BN-2013-7934159,"Tenex File Cart, Single Width",0.1,$362.00,-$4.00,3,Office Supplies,Storage
AZ-2013-5637964,"Acco Binder Covers, Durable",0,$44.00,$20.00,3,Office Supplies,Binders
AZ-2013-5637964,"Wilson Jones 3-Hole Punch, Economy",0,$84.00,$28.00,3,Office Supplies,Binders
AZ-2013-5637964,"Wilson Jones 3-Hole Punch, Economy",0,$84.00,$28.00,3,Office Supplies,Binders
AZ-2013-2709620,"Belkin Mouse, Erganomic",0,$347.00,$59.00,9,Technology,Accessories
AZ-2013-5637964,"Enermax Router, Programmable",0,"$2,079.00",$852.00,8,Technology,Accessories
AZ-2013-5637964,"Hewlett Wireless Fax, Laser",0,$760.00,$236.00,2,Technology,Copiers
AZ-2013-6548311,"Bush Stackable Bookrack, Traditional",0,$369.00,$92.00,3,Furniture,Bookcases
AZ-2013-6548311,"Acco 3-Hole Punch, Recycled",0,$213.00,$19.00,7,Office Supplies,Binders
AZ-2013-6548311,"Cameo Interoffice Envelope, Security-Tint",0,$100.00,$10.00,2,Office Supplies,Envelopes
AZ-2013-1146430,"Binney & Smith Sketch Pad, Water Color",0.1,$178.00,$45.00,4,Office Supplies,Art
AZ-2013-1146430,"Epson Card Printer, Durable",0.1,"$1,071.00",$286.00,7,Technology,Machines
AZ-2013-1146430,"Okidata Calculator, White",0.1,$137.00,-$12.00,3,Technology,Machines
AZ-2013-8774500,"Novimex Executive Leather Armchair, Red",0.1,"$1,243.00",$345.00,3,Furniture,Chairs
AZ-2013-8774500,"Fellowes Box, Blue",0.1,$53.00,$3.00,3,Office Supplies,Storage
AZ-2013-8774500,"Logitech Router, Programmable",0,"$1,244.00",$448.00,5,Technology,Accessories
AZ-2013-8795323,"Wilson Jones Index Tab, Economy",0,$58.00,$15.00,9,Office Supplies,Binders
AZ-2013-7006119,"Stanley Sketch Pad, Fluorescent",0,$91.00,$15.00,2,Office Supplies,Art
AZ-2013-8795323,"Belkin Numeric Keypad, Erganomic",0,$59.00,$1.00,1,Technology,Accessories
AZ-2013-8795323,"Enermax Flash Drive, USB",0,$334.00,$130.00,8,Technology,Accessories
AZ-2013-6244362,"Nokia Headset, with Caller ID",0,$292.00,$35.00,4,Technology,Phones
AZ-2013-7006119,"HP Fax Machine, Laser",0,"$1,200.00",$480.00,4,Technology,Copiers
AZ-2013-3352012,"Deflect-O Frame, Durable",0,$428.00,$176.00,4,Furniture,Furnishings
AZ-2013-3352012,"Boston Pens, Easy-Erase",0,$29.00,$10.00,2,Office Supplies,Art
AZ-2013-3352012,"Ibico Binder, Durable",0,$34.00,$1.00,2,Office Supplies,Binders
AZ-2013-3352012,"Eldon Trays, Blue",0,$240.00,$43.00,5,Office Supplies,Storage
BN-2013-4285479,"Fellowes Box, Single Width",0.1,$53.00,-$2.00,3,Office Supplies,Storage
AZ-2013-3352012,"StarTech Phone, Wireless",0,$298.00,$24.00,4,Technology,Machines
BN-2013-4285479,"Sharp Personal Copier, Digital",0,$598.00,$299.00,5,Technology,Copiers
AZ-2013-8633659,"Deflect-O Door Stop, Duo Pack",0,$264.00,$95.00,6,Furniture,Furnishings
AZ-2013-8633659,"Boston Sketch Pad, Fluorescent",0,$150.00,$0.00,3,Office Supplies,Art
BN-2013-5104816,"Fellowes Box, Blue",0.4,$47.00,-$19.00,4,Office Supplies,Storage
AZ-2013-343563,"Advantus Rubber Bands, 12 Pack",0,$48.00,$13.00,3,Office Supplies,Fasteners
AZ-2013-7431618,"Bush 3-Shelf Cabinet, Mobile",0.1,$263.00,$15.00,2,Furniture,Bookcases
AZ-2013-7431618,"Stiletto Ruler, Steel",0,$43.00,$21.00,3,Office Supplies,Supplies
AZ-2013-8367272,"Belkin Memory Card, Programmable",0,$582.00,$174.00,5,Technology,Accessories
AZ-2013-6053610,"Advantus Photo Frame, Duo Pack",0,$159.00,$60.00,3,Furniture,Furnishings
AZ-2013-6053610,"Stockwell Staples, Assorted Sizes",0,$25.00,$11.00,3,Office Supplies,Fasteners
AZ-2013-5974172,"Canon Personal Copier, High-Speed",0.65,$592.00,-$643.00,12,Technology,Copiers
AZ-2013-4874809,"Chromcraft Conference Table, with Bottom Storage",0,$873.00,$61.00,1,Furniture,Tables
AZ-2013-4874809,"Stanley Pens, Blue",0,$40.00,$20.00,4,Office Supplies,Art
AZ-2013-4874809,"Cardinal Binder Covers, Economy",0,$48.00,$2.00,4,Office Supplies,Binders
AZ-2013-8131512,"BIC Pens, Easy-Erase",0,$102.00,$22.00,7,Office Supplies,Art
BN-2013-5022236,"Avery Binder, Clear",0.5,$49.00,-$40.00,8,Office Supplies,Binders
BN-2013-5022236,"Cardinal Index Tab, Clear",0.5,$7.00,-$2.00,2,Office Supplies,Binders
BN-2013-5022236,"Eaton Computer Printout Paper, Multicolor",0.5,$14.00,-$10.00,1,Office Supplies,Paper
AZ-2013-2582964,"BIC Sketch Pad, Water Color",0,$52.00,$8.00,1,Office Supplies,Art
AZ-2013-5337437,"BIC Sketch Pad, Fluorescent",0,$100.00,$33.00,2,Office Supplies,Art
AZ-2013-5337437,"Kleencut Box Cutter, Steel",0,$136.00,$22.00,4,Office Supplies,Supplies
AZ-2013-5337437,"Nokia Headset, with Caller ID",0.4,$132.00,-$61.00,3,Technology,Phones
AZ-2013-4627833,"Sauder Library with Doors, Pine",0,$778.00,$62.00,2,Furniture,Bookcases
AZ-2013-4627833,"Lesro Round Table, Rectangular",0,$899.00,$396.00,2,Furniture,Tables
AZ-2013-4627833,"Cardinal Index Tab, Clear",0,$27.00,$11.00,4,Office Supplies,Binders
AZ-2013-649774,"Dania Floating Shelf Set, Metal",0,$506.00,$192.00,3,Furniture,Bookcases
BN-2013-9068340,"Enermax Cards & Envelopes, 8.5 x 11",0.5,$77.00,-$63.00,3,Office Supplies,Paper
BN-2013-9068340,"Elite Ruler, High Speed",0.5,$76.00,-$64.00,11,Office Supplies,Supplies
AZ-2013-649774,"Acco Index Tab, Clear",0,$8.00,$3.00,1,Office Supplies,Binders
AZ-2013-649774,"Epson Receipt Printer, Red",0,$228.00,$114.00,2,Technology,Machines
BN-2013-2488199,"Hewlett Ink, Color",0.15,$383.00,-$5.00,3,Technology,Copiers
AZ-2013-1568579,"Fellowes Box, Wire Frame",0.1,$51.00,$20.00,3,Office Supplies,Storage
AZ-2013-1568579,"Brother Fax and Copier, High-Speed",0.1,"$1,536.00",$171.00,9,Technology,Copiers
AZ-2013-4520943,"SAFCO Swivel Stool, Adjustable",0.2,$409.00,$143.00,3,Furniture,Chairs
AZ-2013-4520943,"Avery Hole Reinforcements, Durable",0.1,$16.00,$5.00,3,Office Supplies,Binders
BN-2013-5978762,"Smead Round Labels, Adjustable",0.5,$5.00,-$2.00,2,Office Supplies,Labels
BN-2013-5978762,"Smead Trays, Single Width",0.5,$49.00,-$17.00,2,Office Supplies,Storage
BN-2013-5978762,"HP Wireless Fax, High-Speed",0.5,$896.00,-$36.00,5,Technology,Copiers
BN-2013-1963418,"Ibico Hole Reinforcements, Clear",0,$6.00,$2.00,1,Office Supplies,Binders
BN-2013-1963418,"Hon Shipping Labels, Alphabetical",0,$22.00,$10.00,2,Office Supplies,Labels
AZ-2013-4878818,"GlobeWeis Clasp Envelope, Recycled",0,$26.00,$7.00,3,Office Supplies,Envelopes
AZ-2013-4284308,"Fellowes Trays, Single Width",0.4,$69.00,$11.00,2,Office Supplies,Storage
AZ-2013-2526896,"Rubbermaid Clock, Duo Pack",0,$251.00,$40.00,5,Furniture,Furnishings
AZ-2013-2526896,"Enermax Computer Printout Paper, Multicolor",0,$149.00,$4.00,5,Office Supplies,Paper
AZ-2013-2526896,"Tenex File Cart, Single Width",0,$269.00,$126.00,2,Office Supplies,Storage
AZ-2013-2526896,"Hewlett Wireless Fax, Laser",0,"$3,422.00","$1,061.00",9,Technology,Copiers
AZ-2013-183270,"Boston Pencil Sharpener, Water Color",0,$58.00,$8.00,2,Office Supplies,Art
AZ-2013-183270,"Green Bar Parchment Paper, Premium",0,$33.00,$1.00,2,Office Supplies,Paper
AZ-2013-9549607,"Advantus Frame, Erganomic",0,$439.00,$140.00,4,Furniture,Furnishings
AZ-2013-9549607,"Rubbermaid Photo Frame, Durable",0,$146.00,$7.00,3,Furniture,Furnishings
AZ-2013-9549607,"Avery Binder Covers, Economy",0,$44.00,$14.00,4,Office Supplies,Binders
AZ-2013-6510557,"Fellowes Lockers, Industrial",0.4,$623.00,$41.00,5,Office Supplies,Storage
AZ-2013-9485550,"Rubbermaid Clock, Durable",0.3,$99.00,$8.00,3,Furniture,Furnishings
AZ-2013-9485550,"Cuisinart Microwave, Black",0,$278.00,$14.00,1,Office Supplies,Appliances
AZ-2013-9591675,"Eldon Door Stop, Erganomic",0,$98.00,$13.00,2,Furniture,Furnishings
AZ-2013-9591675,"Tenex Stacking Tray, Erganomic",0,$67.00,$30.00,3,Furniture,Furnishings
AZ-2013-4330374,"Dania Stackable Bookrack, Pine",0,$492.00,$5.00,4,Furniture,Bookcases
AZ-2013-4330374,"Bevis Computer Table, Fully Assembled",0.5,$989.00,-$435.00,4,Furniture,Tables
AZ-2013-9591675,"OIC Thumb Tacks, 12 Pack",0,$41.00,$16.00,3,Office Supplies,Fasteners
BN-2013-8532201,"Sanford Pencil Sharpener, Water Color",0,$29.00,$3.00,1,Office Supplies,Art
AZ-2013-4330374,"Acco Binding Machine, Durable",0,$158.00,$38.00,3,Office Supplies,Binders
AZ-2013-4330374,"Avery Index Tab, Clear",0,$19.00,$1.00,3,Office Supplies,Binders
AZ-2013-4330374,"Cardinal 3-Hole Punch, Clear",0,$85.00,$18.00,3,Office Supplies,Binders
AZ-2013-4330374,"Cardinal Binder, Economy",0,$14.00,$5.00,1,Office Supplies,Binders
AZ-2013-4330374,"SanDisk Parchment Paper, Recycled",0,$66.00,$11.00,4,Office Supplies,Paper
AZ-2013-4330374,"Stiletto Letter Opener, High Speed",0,$111.00,$19.00,4,Office Supplies,Supplies
BN-2013-8532201,"Epson Card Printer, Durable",0.4,$204.00,-$20.00,2,Technology,Machines
AZ-2013-4330374,"StarTech Receipt Printer, Wireless",0.4,$66.00,-$36.00,1,Technology,Machines
AZ-2013-866971,"Bush Classic Bookcase, Traditional",0,"$2,476.00","$1,015.00",6,Furniture,Bookcases
AZ-2013-866971,"Boston Pens, Easy-Erase",0,$58.00,$19.00,4,Office Supplies,Art
BN-2013-9131358,"Harbour Creations Steel Folding Chair, Red",0.6,$78.00,-$65.00,2,Furniture,Chairs
AZ-2013-3893358,"Tenex Clock, Erganomic",0,$244.00,$110.00,5,Furniture,Furnishings
AZ-2013-5532307,"Cardinal Binding Machine, Clear",0,$98.00,$39.00,2,Office Supplies,Binders
AZ-2013-3893358,"Boston Markers, Fluorescent",0,$83.00,$12.00,3,Office Supplies,Art
AZ-2013-3893358,"Ibico Hole Reinforcements, Economy",0,$28.00,$14.00,4,Office Supplies,Binders
BN-2013-9871283,"Panasonic Printer, Red",0.15,$448.00,$0.00,2,Technology,Machines
AZ-2013-906289,"StarTech Card Printer, Red",0,$321.00,$35.00,2,Technology,Machines
BN-2013-2045874,"Harbour Creations Rocking Chair, Adjustable",0.1,$404.00,$99.00,3,Furniture,Chairs
BN-2013-2045874,"Xerox Cards & Envelopes, 8.5 x 11",0,$246.00,$39.00,5,Office Supplies,Paper
BN-2013-2045874,"Fellowes Shelving, Blue",0.1,$156.00,$47.00,3,Office Supplies,Storage
BN-2013-2045874,"Okidata Card Printer, Durable",0.15,$299.00,-$25.00,2,Technology,Machines
BN-2013-6886875,"GlobeWeis Clasp Envelope, Recycled",0.5,$22.00,-$11.00,5,Office Supplies,Envelopes
BN-2013-6886875,"Eldon Lockers, Wire Frame",0.5,$197.00,-$118.00,2,Office Supplies,Storage
AZ-2013-5932628,"Safco Corner Shelving, Traditional",0,$448.00,$81.00,3,Furniture,Bookcases
AZ-2013-5932628,"Advantus Light Bulb, Duo Pack",0,$40.00,$8.00,2,Furniture,Furnishings
AZ-2013-5932628,"Cuisinart Refrigerator, Silver",0,"$1,987.00",$338.00,4,Office Supplies,Appliances
AZ-2013-5932628,"Boston Canvas, Fluorescent",0,$165.00,$30.00,3,Office Supplies,Art
AZ-2013-5932628,"Avery 3-Hole Punch, Durable",0,$59.00,$21.00,2,Office Supplies,Binders
AZ-2013-5932628,"SanDisk Computer Printout Paper, Recycled",0,$149.00,$67.00,5,Office Supplies,Paper
AZ-2013-5932628,"Smead Box, Wire Frame",0,$49.00,$8.00,5,Office Supplies,Storage
AZ-2013-5248239,"Breville Microwave, Red",0,$905.00,$81.00,3,Office Supplies,Appliances
AZ-2013-5248239,"Boston Pencil Sharpener, Easy-Erase",0,$91.00,$14.00,3,Office Supplies,Art
AZ-2013-5248239,"Boston Sketch Pad, Blue",0,$194.00,$84.00,4,Office Supplies,Art
AZ-2013-5248239,"Sanford Pencil Sharpener, Water Color",0,$116.00,$13.00,4,Office Supplies,Art
AZ-2013-5248239,"Jiffy Manila Envelope, Security-Tint",0,$57.00,$28.00,2,Office Supplies,Envelopes
AZ-2013-5248239,"Cisco Smart Phone, Cordless",0,"$1,954.00",$782.00,3,Technology,Phones
AZ-2013-9510969,"Bevis Round Table, Adjustable Height",0.35,"$1,691.00",-$833.00,5,Furniture,Tables
BN-2013-6154570,"Hamilton Beach Toaster, Red",0.1,$104.00,-$7.00,2,Office Supplies,Appliances
AZ-2013-9510969,"BIC Sketch Pad, Water Color",0,$415.00,$62.00,8,Office Supplies,Art
AZ-2013-9510969,"Acco Binder, Clear",0,$29.00,$10.00,2,Office Supplies,Binders
AZ-2013-9510969,"Xerox Message Books, Recycled",0,$41.00,$13.00,2,Office Supplies,Paper
BN-2013-6154570,"Logitech Router, Bluetooth",0,$742.00,$59.00,3,Technology,Accessories
AZ-2013-5548332,"Tenex Frame, Erganomic",0,$326.00,$107.00,3,Furniture,Furnishings
AZ-2013-5548332,"Advantus Thumb Tacks, Assorted Sizes",0,$44.00,$7.00,4,Office Supplies,Fasteners
AZ-2013-8493783,"Acco Binding Machine, Economy",0,$255.00,$74.00,5,Office Supplies,Binders
AZ-2013-8493783,"Canon Fax and Copier, Color",0,$964.00,$231.00,5,Technology,Copiers
AZ-2013-2914891,"Ikea Classic Bookcase, Traditional",0,"$1,235.00",$469.00,3,Furniture,Bookcases
AZ-2013-2914891,"Cameo Clasp Envelope, Security-Tint",0,$83.00,$20.00,7,Office Supplies,Envelopes
AZ-2013-2914891,"Advantus Staples, Metal",0,$22.00,$9.00,2,Office Supplies,Fasteners
AZ-2013-2914891,"Eldon Lockers, Blue",0.4,$475.00,-$238.00,4,Office Supplies,Storage
AZ-2013-2914891,"Nokia Smart Phone, Full Size",0.4,$765.00,-$370.00,2,Technology,Phones
AZ-2013-7137093,"Binney & Smith Pens, Blue",0.1,$86.00,$31.00,8,Office Supplies,Art
AZ-2013-7137093,"Logitech Router, Programmable",0.1,$672.00,$194.00,3,Technology,Accessories
AZ-2013-9746580,"Safco Corner Shelving, Traditional",0.1,$135.00,$12.00,1,Furniture,Bookcases
AZ-2013-9746580,"Hon Steel Folding Chair, Adjustable",0.1,$680.00,$60.00,9,Furniture,Chairs
AZ-2013-1483452,"Hoover Microwave, White",0,"$2,147.00",$580.00,7,Office Supplies,Appliances
AZ-2013-2857120,"Stockwell Rubber Bands, Metal",0,$49.00,$24.00,3,Office Supplies,Fasteners
AZ-2013-2857120,"Panasonic Receipt Printer, White",0.15,$304.00,$72.00,3,Technology,Machines
AZ-2013-6875037,"BIC Pencil Sharpener, Easy-Erase",0,$88.00,$4.00,3,Office Supplies,Art
AZ-2013-6875037,"Eaton Memo Slips, 8.5 x 11",0,$18.00,$5.00,1,Office Supplies,Paper
AZ-2013-2185600,"Sharp Fax Machine, Laser",0,"$2,070.00",$186.00,7,Technology,Copiers
AZ-2013-8277414,"Advantus Stacking Tray, Black",0,$106.00,$30.00,4,Furniture,Furnishings
AZ-2013-8277414,"Binney & Smith Highlighters, Fluorescent",0,$71.00,$6.00,4,Office Supplies,Art
AZ-2013-7300382,"Jiffy Business Envelopes, Security-Tint",0,$32.00,$2.00,2,Office Supplies,Envelopes
AZ-2013-7300382,"Sharp Ink, High-Speed",0,$490.00,$39.00,4,Technology,Copiers
AZ-2013-9188283,"Sanford Pencil Sharpener, Water Color",0,$131.00,$34.00,5,Office Supplies,Art
BN-2013-9881069,"Office Star Bag Chairs, Set of Two",0.2,$323.00,-$61.00,7,Furniture,Chairs
BN-2013-9881069,"Enermax Flash Drive, Programmable",0.1,$155.00,$45.00,4,Technology,Accessories
BN-2013-9881069,"Nokia Speaker Phone, Full Size",0.1,$336.00,$37.00,3,Technology,Phones
AZ-2013-8689698,"Stiletto Shears, High Speed",0,$385.00,$35.00,8,Office Supplies,Supplies
AZ-2013-9221465,"BIC Canvas, Blue",0,$269.00,$21.00,5,Office Supplies,Art
AZ-2013-9221465,"Tenex Folders, Wire Frame",0.4,$53.00,$7.00,4,Office Supplies,Storage
AZ-2013-9221465,"Logitech Flash Drive, Bluetooth",0,$92.00,$39.00,3,Technology,Accessories
AZ-2013-9221465,"Canon Fax Machine, High-Speed",0,$950.00,$114.00,3,Technology,Copiers
AZ-2013-9221465,"Samsung Smart Phone, Cordless",0.4,"$2,684.00","-$1,476.00",7,Technology,Phones
AZ-2013-8064261,"Eldon Door Stop, Durable",0,$189.00,$40.00,4,Furniture,Furnishings
AZ-2013-8064261,"Hoover Stove, Red",0,"$3,979.00","$1,990.00",7,Office Supplies,Appliances
AZ-2013-7036951,"Advantus Door Stop, Duo Pack",0,$180.00,$11.00,4,Furniture,Furnishings
BN-2013-80695,"Rogers Folders, Single Width",0.1,$28.00,-$1.00,1,Office Supplies,Storage
BN-2013-80695,"Kleencut Box Cutter, Serrated",0,$94.00,$21.00,3,Office Supplies,Supplies
AZ-2013-576501,"Acco Hole Reinforcements, Economy",0,$7.00,$1.00,1,Office Supplies,Binders
AZ-2013-7001055,"Smead Lockers, Industrial",0,$597.00,$167.00,3,Office Supplies,Storage
AZ-2013-6796534,"Canon Copy Machine, Color",0,$264.00,$66.00,1,Technology,Copiers
BN-2013-6883995,"Office Star Steel Folding Chair, Black",0.1,$241.00,-$27.00,3,Furniture,Chairs
BN-2013-6883995,"Belkin Memory Card, USB",0,$460.00,$0.00,4,Technology,Accessories
BN-2013-6883995,"Sharp Fax Machine, High-Speed",0.15,"$1,249.00",$88.00,5,Technology,Copiers
AZ-2013-8090289,"Novimex Executive Leather Armchair, Red",0.1,$414.00,$115.00,1,Furniture,Chairs
AZ-2013-8019814,"Motorola Signal Booster, with Caller ID",0,$286.00,$114.00,2,Technology,Phones
AZ-2013-8958085,"BIC Sketch Pad, Fluorescent",0,$499.00,$165.00,10,Office Supplies,Art
AZ-2013-8958085,"Binney & Smith Pens, Water Color",0,$30.00,$11.00,2,Office Supplies,Art
AZ-2013-8958085,"Acco Binder, Durable",0,$133.00,$37.00,8,Office Supplies,Binders
AZ-2013-8958085,"Smead Shipping Labels, Alphabetical",0,$69.00,$16.00,6,Office Supplies,Labels
AZ-2013-8958085,"Tenex Lockers, Wire Frame",0.4,$488.00,-$73.00,4,Office Supplies,Storage
AZ-2013-8958085,"Acme Scissors, Serrated",0,$89.00,$5.00,4,Office Supplies,Supplies
AZ-2013-8958085,"Canon Ink, Color",0,$297.00,$56.00,2,Technology,Copiers
AZ-2013-8958085,"HP Wireless Fax, Color",0,$723.00,$7.00,2,Technology,Copiers
AZ-2013-5213862,"GlobeWeis Manila Envelope, Security-Tint",0,$209.00,$2.00,7,Office Supplies,Envelopes
AZ-2013-5213862,"Rogers Trays, Wire Frame",0.1,$164.00,$71.00,3,Office Supplies,Storage
BN-2013-6854769,"Hon Steel Folding Chair, Red",0.5,$122.00,-$7.00,3,Furniture,Chairs
AZ-2013-7058808,"Advantus Clock, Duo Pack",0,$51.00,$6.00,1,Furniture,Furnishings
AZ-2013-2963078,"Avery Binding Machine, Durable",0,$201.00,$12.00,4,Office Supplies,Binders
BN-2013-4141546,"Advantus Clock, Black",0,$154.00,$45.00,3,Furniture,Furnishings
BN-2013-4141546,"Tenex File Cart, Single Width",0.1,"$1,333.00",$548.00,11,Office Supplies,Storage
BN-2013-4141546,"Nokia Speaker Phone, VoIP",0.1,"$1,331.00",-$104.00,12,Technology,Phones
AZ-2013-6224487,"Office Star Executive Leather Armchair, Red",0.1,"$2,959.00",$953.00,7,Furniture,Chairs
AZ-2013-6085287,"Sanford Canvas, Fluorescent",0,$52.00,$19.00,1,Office Supplies,Art
AZ-2013-6085287,"Fiskars Letter Opener, Steel",0,$49.00,$9.00,2,Office Supplies,Supplies
AZ-2013-6920962,"Stanley Markers, Fluorescent",0,$70.00,$24.00,3,Office Supplies,Art
AZ-2013-4349254,"Fellowes File Cart, Wire Frame",0.1,$245.00,$30.00,2,Office Supplies,Storage
AZ-2013-7982799,"Chromcraft Coffee Table, Fully Assembled",0.6,$215.00,-$247.00,2,Furniture,Tables
AZ-2013-7982799,"Binney & Smith Markers, Water Color",0,$191.00,$32.00,7,Office Supplies,Art
AZ-2013-3881285,"Advantus Push Pins, Assorted Sizes",0,$48.00,$9.00,4,Office Supplies,Fasteners
AZ-2013-7409274,"Enermax Memory Card, Erganomic",0,$224.00,$105.00,2,Technology,Accessories
AZ-2013-7409274,"StarTech Printer, Wireless",0,$769.00,$169.00,3,Technology,Machines
