Order ID,Product Name,Discount,Sales,Profit,Quantity,Category,Sub-Category
AZ-2012-9884785,"Ames Mailers, Security-Tint",0,$230.00,$21.00,6,Office Supplies,Envelopes
AZ-2012-8884633,"Avery Binding Machine, Recycled",0,$98.00,$42.00,2,Office Supplies,Binders
AZ-2012-768602,"Cameo Clasp Envelope, Security-Tint",0,$36.00,$9.00,3,Office Supplies,Envelopes
AZ-2012-7477983,"Advantus Frame, Durable",0,$973.00,$107.00,9,Furniture,Furnishings
AZ-2012-7477983,"Acco Index Tab, Clear",0,$16.00,$7.00,2,Office Supplies,Binders
AZ-2012-7477983,"Cameo Business Envelopes, Recycled",0,$77.00,$8.00,4,Office Supplies,Envelopes
AZ-2012-5575176,"Advantus Light Bulb, Black",0,$40.00,$19.00,2,Furniture,Furnishings
AZ-2012-4828217,"Sanford Canvas, Blue",0,$152.00,$44.00,3,Office Supplies,Art
AZ-2012-6744680,"Stockwell Staples, Assorted Sizes",0,$58.00,$25.00,7,Office Supplies,Fasteners
AZ-2012-6744680,"Novimex Legal Exhibit Labels, Laser Printer Compatible",0,$21.00,$7.00,2,Office Supplies,Labels
AZ-2012-5610095,"Harbour Creations Removable Labels, Adjustable",0.1,$37.00,$2.00,5,Office Supplies,Labels
AZ-2012-2860153,"Apple Audio Dock, with Caller ID",0,$501.00,$75.00,3,Technology,Phones
AZ-2012-6992927,"Cameo Interoffice Envelope, Recycled",0,$92.00,$39.00,2,Office Supplies,Envelopes
AZ-2012-6992927,"Smead Folders, Blue",0,$35.00,$4.00,2,Office Supplies,Storage
BN-2012-6756198,"Rogers File Cart, Single Width",0.4,$510.00,-$119.00,6,Office Supplies,Storage
AZ-2012-385874,"Boston Pens, Water Color",0,$52.00,$5.00,3,Office Supplies,Art
AZ-2012-51069,"Tenex Trays, Single Width",0.1,$146.00,$46.00,3,Office Supplies,Storage
AZ-2012-1968371,"Binney & Smith Markers, Easy-Erase",0,$97.00,$39.00,4,Office Supplies,Art
AZ-2012-1968371,"Binney & Smith Sketch Pad, Water Color",0,$149.00,$49.00,3,Office Supplies,Art
AZ-2012-1968371,"Boston Pens, Water Color",0,$104.00,$9.00,6,Office Supplies,Art
AZ-2012-1968371,"HP Fax Machine, High-Speed",0,"$1,491.00",$74.00,5,Technology,Copiers
AZ-2012-7344517,"Fiskars Letter Opener, High Speed",0,$55.00,$2.00,2,Office Supplies,Supplies
BN-2012-26008,"Office Star Bag Chairs, Black",0.5,$159.00,-$29.00,6,Furniture,Chairs
BN-2012-26008,"OIC Paper Clips, Assorted Sizes",0.5,$12.00,-$6.00,2,Office Supplies,Fasteners
BN-2012-26008,"Enermax Memo Slips, Recycled",0.5,$8.00,-$5.00,1,Office Supplies,Paper
BN-2012-26008,"Enermax Note Cards, Premium",0.5,$60.00,-$35.00,4,Office Supplies,Paper
BN-2012-26008,"Nokia Speaker Phone, Full Size",0.5,$249.00,-$149.00,4,Technology,Phones
AZ-2012-7800585,"Safco Floating Shelf Set, Pine",0.1,$357.00,$20.00,2,Furniture,Bookcases
AZ-2012-5071313,"Stanley Pens, Water Color",0,$53.00,$17.00,4,Office Supplies,Art
AZ-2012-6341558,"Binney & Smith Pens, Water Color",0,$30.00,$11.00,2,Office Supplies,Art
AZ-2012-6341558,"Tenex File Cart, Industrial",0,$402.00,$76.00,3,Office Supplies,Storage
AZ-2012-7094138,"Eldon Shelving, Blue",0.1,$87.00,$16.00,2,Office Supplies,Storage
BN-2012-8691355,"Samsung Signal Booster, with Caller ID",0.5,$341.00,-$341.00,5,Technology,Phones
BN-2012-6248125,"Office Star Steel Folding Chair, Red",0.5,$183.00,-$140.00,4,Furniture,Chairs
BN-2012-6248125,"Wilson Jones Binder, Recycled",0.5,$47.00,-$11.00,7,Office Supplies,Binders
BN-2012-4716466,"Eldon Box, Single Width",0,$21.00,$6.00,2,Office Supplies,Storage
BN-2012-3975378,"Novimex Bag Chairs, Set of Two",0.6,$96.00,-$87.00,5,Furniture,Chairs
AZ-2012-7754388,"Eldon Lockers, Industrial",0.1,$714.00,$309.00,4,Office Supplies,Storage
BN-2012-3975378,"Eldon File Cart, Single Width",0.4,$154.00,$8.00,2,Office Supplies,Storage
BN-2012-3975378,"Rogers Trays, Blue",0.4,$37.00,-$6.00,1,Office Supplies,Storage
AZ-2012-7754388,"Hewlett Fax Machine, Laser",0,$320.00,$16.00,1,Technology,Copiers
AZ-2012-1667717,"Stanley Pencil Sharpener, Water Color",0,$84.00,$3.00,3,Office Supplies,Art
AZ-2012-8270479,"Logitech Keyboard, Erganomic",0,$492.00,$44.00,7,Technology,Accessories
AZ-2012-8270479,"Motorola Office Telephone, Full Size",0.15,$373.00,$74.00,6,Technology,Phones
AZ-2012-5209012,"Ibico Binder Covers, Clear",0,$92.00,$6.00,7,Office Supplies,Binders
AZ-2012-5209012,"Harbour Creations Round Labels, Alphabetical",0,$59.00,$23.00,9,Office Supplies,Labels
AZ-2012-5209012,"Eldon Folders, Single Width",0.1,$61.00,$25.00,4,Office Supplies,Storage
AZ-2012-5209012,"Smead Shelving, Wire Frame",0.1,$130.00,$52.00,3,Office Supplies,Storage
AZ-2012-5209012,"Acme Box Cutter, High Speed",0,$113.00,$54.00,3,Office Supplies,Supplies
AZ-2012-5209012,"Logitech Numeric Keypad, Erganomic",0,$397.00,$163.00,9,Technology,Accessories
AZ-2012-2145523,"Smead Box, Single Width",0.1,$39.00,$7.00,4,Office Supplies,Storage
AZ-2012-4858195,"Stanley Pencil Sharpener, Water Color",0,$28.00,$1.00,1,Office Supplies,Art
AZ-2012-4858195,"Acco 3-Hole Punch, Economy",0,$90.00,$17.00,3,Office Supplies,Binders
AZ-2012-4858195,"Belkin Memory Card, Bluetooth",0,$230.00,$50.00,2,Technology,Accessories
AZ-2012-4858195,"Logitech Router, Erganomic",0,$981.00,$176.00,4,Technology,Accessories
BN-2012-9976090,"Office Star Bag Chairs, Black",0.5,$27.00,-$5.00,1,Furniture,Chairs
AZ-2012-4642183,"Fellowes File Cart, Industrial",0.1,$248.00,$8.00,2,Office Supplies,Storage
BN-2012-9976090,"Acco Binder Covers, Durable",0.5,$37.00,-$4.00,5,Office Supplies,Binders
BN-2012-9976090,"Apple Headset, with Caller ID",0.5,$73.00,-$51.00,2,Technology,Phones
BN-2012-834682,"Boston Sketch Pad, Easy-Erase",0.5,$49.00,-$21.00,2,Office Supplies,Art
AZ-2012-6682844,"Xerox Cards & Envelopes, Recycled",0,$135.00,$43.00,3,Office Supplies,Paper
AZ-2012-6682844,"Fellowes Box, Wire Frame",0.4,$56.00,$6.00,5,Office Supplies,Storage
BN-2012-834682,"Memorex Numeric Keypad, USB",0.5,$86.00,-$29.00,4,Technology,Accessories
AZ-2012-5685113,"Cameo Clasp Envelope, Security-Tint",0,$36.00,$9.00,3,Office Supplies,Envelopes
AZ-2012-252256,"Bush Library with Doors, Metal",0,"$2,546.00",$382.00,7,Furniture,Bookcases
AZ-2012-3045764,"Cardinal Hole Reinforcements, Clear",0,$24.00,$11.00,5,Office Supplies,Binders
AZ-2012-252256,"Jiffy Business Envelopes, Security-Tint",0,$48.00,$3.00,3,Office Supplies,Envelopes
AZ-2012-252256,"Fellowes Trays, Blue",0.4,$138.00,-$76.00,4,Office Supplies,Storage
AZ-2012-252256,"Acme Scissors, Easy Grip",0,$108.00,$26.00,4,Office Supplies,Supplies
AZ-2012-252256,"Stiletto Ruler, Serrated",0,$46.00,$15.00,4,Office Supplies,Supplies
AZ-2012-2467107,"Hon Rocking Chair, Adjustable",0.1,$120.00,$51.00,1,Furniture,Chairs
AZ-2012-2467107,"Barricks Conference Table, Adjustable Height",0.35,"$2,364.00",-$218.00,4,Furniture,Tables
AZ-2012-2467107,"Novimex Shipping Labels, Alphabetical",0,$43.00,$22.00,4,Office Supplies,Labels
AZ-2012-2961412,"Deflect-O Stacking Tray, Durable",0.3,$53.00,-$19.00,3,Furniture,Furnishings
AZ-2012-2961412,"Ames Interoffice Envelope, Security-Tint",0,$95.00,$47.00,2,Office Supplies,Envelopes
AZ-2012-2961412,"HP Fax Machine, Laser",0,$900.00,$360.00,3,Technology,Copiers
AZ-2012-2961412,"Motorola Signal Booster, VoIP",0,$716.00,$36.00,5,Technology,Phones
AZ-2012-564106,"Fellowes Trays, Wire Frame",0.1,$152.00,$25.00,3,Office Supplies,Storage
AZ-2012-564106,"Hewlett Copy Machine, Color",0,$530.00,$180.00,2,Technology,Copiers
AZ-2012-564106,"Sharp Copy Machine, Laser",0,$717.00,$93.00,3,Technology,Copiers
AZ-2012-564106,"Motorola Office Telephone, Full Size",0,$365.00,$117.00,5,Technology,Phones
AZ-2012-534231,"Hon Steel Folding Chair, Set of Two",0,$586.00,$123.00,7,Furniture,Chairs
AZ-2012-534231,"Sanford Markers, Water Color",0,$79.00,$7.00,3,Office Supplies,Art
AZ-2012-534231,"Cameo Clasp Envelope, Security-Tint",0,$36.00,$9.00,3,Office Supplies,Envelopes
AZ-2012-5605130,"Hamilton Beach Stove, Silver",0.1,"$2,444.00",$760.00,5,Office Supplies,Appliances
AZ-2012-5605130,"Binney & Smith Pens, Easy-Erase",0,$12.00,$0.00,1,Office Supplies,Art
AZ-2012-5605130,"Hon Color Coded Labels, Alphabetical",0,$25.00,$0.00,2,Office Supplies,Labels
AZ-2012-5605130,"Rogers Folders, Blue",0.1,$138.00,-$12.00,5,Office Supplies,Storage
AZ-2012-5605130,"Samsung Smart Phone, Full Size",0.15,"$2,167.00",$790.00,4,Technology,Phones
AZ-2012-2772170,"Wilson Jones 3-Hole Punch, Recycled",0,$198.00,$59.00,7,Office Supplies,Binders
AZ-2012-9269920,"Deflect-O Clock, Durable",0,$142.00,$45.00,3,Furniture,Furnishings
AZ-2012-9269920,"Eldon Door Stop, Duo Pack",0,$151.00,$47.00,3,Furniture,Furnishings
AZ-2012-9269920,"Ibico Hole Reinforcements, Clear",0,$13.00,$5.00,2,Office Supplies,Binders
AZ-2012-9269920,"Tenex Shelving, Single Width",0.1,$49.00,$8.00,1,Office Supplies,Storage
AZ-2012-9269920,"Kleencut Scissors, Steel",0,$43.00,$3.00,2,Office Supplies,Supplies
AZ-2012-8935419,"Novimex File Folder Labels, Alphabetical",0,$24.00,$3.00,3,Office Supplies,Labels
AZ-2012-8935419,"Motorola Headset, Cordless",0,$248.00,$79.00,3,Technology,Phones
AZ-2012-8267693,"Harbour Creations Executive Leather Armchair, Adjustable",0.1,"$2,571.00",$857.00,6,Furniture,Chairs
AZ-2012-19748,"Dania Classic Bookcase, Metal",0.1,"$2,584.00",$660.00,7,Furniture,Bookcases
AZ-2012-1629233,"Acco Hole Reinforcements, Recycled",0,$21.00,$11.00,3,Office Supplies,Binders
AZ-2012-910518,"Cardinal Binder Covers, Clear",0,$34.00,$9.00,3,Office Supplies,Binders
BN-2012-9118529,"Advantus Paper Clips, Bulk Pack",0.5,$14.00,-$10.00,2,Office Supplies,Fasteners
AZ-2012-910518,"Nokia Smart Phone, Full Size",0.15,"$1,081.00",$356.00,2,Technology,Phones
AZ-2012-5227678,"Safco Stackable Bookrack, Traditional",0,$297.00,$47.00,2,Furniture,Bookcases
AZ-2012-3239511,"Hoover Toaster, White",0,$164.00,$57.00,2,Office Supplies,Appliances
AZ-2012-1680064,"Stanley Highlighters, Fluorescent",0,$96.00,$35.00,6,Office Supplies,Art
AZ-2012-1472059,"Dania Corner Shelving, Traditional",0,$610.00,$207.00,5,Furniture,Bookcases
AZ-2012-1672161,"Harbour Creations Shipping Labels, 5000 Label Set",0,$24.00,$5.00,2,Office Supplies,Labels
AZ-2012-1672161,"Tenex Shelving, Single Width",0.1,$49.00,$8.00,1,Office Supplies,Storage
AZ-2012-9662305,"Stiletto Box Cutter, Steel",0,$212.00,$15.00,6,Office Supplies,Supplies
AZ-2012-1472059,"Sharp Personal Copier, Laser",0,$120.00,$7.00,1,Technology,Copiers
AZ-2012-9180842,"Fiskars Shears, Steel",0,$94.00,$27.00,2,Office Supplies,Supplies
AZ-2012-8926364,"Cardinal 3-Hole Punch, Economy",0,$144.00,$65.00,5,Office Supplies,Binders
AZ-2012-8926364,"Kraft Interoffice Envelope, Security-Tint",0,$99.00,$10.00,2,Office Supplies,Envelopes
AZ-2012-9627965,"Avery Binding Machine, Clear",0,$48.00,$6.00,1,Office Supplies,Binders
AZ-2012-9627965,"Smead Trays, Single Width",0.1,$131.00,$32.00,3,Office Supplies,Storage
AZ-2012-1714781,"Ikea Floating Shelf Set, Mobile",0.1,$467.00,-$26.00,3,Furniture,Bookcases
AZ-2012-1714781,"HP Ink, High-Speed",0.15,$431.00,-$46.00,4,Technology,Copiers
AZ-2012-1714781,"StarTech Printer, Red",0.15,$646.00,$213.00,3,Technology,Machines
AZ-2012-1169269,"Elite Letter Opener, Easy Grip",0,$145.00,$7.00,5,Office Supplies,Supplies
BN-2012-7150629,"Safco Library with Doors, Mobile",0.1,"$1,765.00",-$98.00,5,Furniture,Bookcases
BN-2012-7150629,"KitchenAid Coffee Grinder, Red",0.1,$190.00,$15.00,3,Office Supplies,Appliances
AZ-2012-5215986,"Cardinal 3-Hole Punch, Clear",0,$85.00,$18.00,3,Office Supplies,Binders
BN-2012-7249062,"Advantus Door Stop, Duo Pack",0.3,$158.00,-$54.00,5,Furniture,Furnishings
AZ-2012-9062597,"Eldon File Cart, Single Width",0.1,$345.00,$31.00,3,Office Supplies,Storage
AZ-2012-569279,"Sharp Ink, Color",0.5,$189.00,-$11.00,3,Technology,Copiers
AZ-2012-9805086,"Avery Index Tab, Economy",0,$39.00,$16.00,5,Office Supplies,Binders
AZ-2012-4114446,"Sanford Pens, Fluorescent",0.1,$22.00,$4.00,2,Office Supplies,Art
AZ-2012-4114446,"Acco Binder, Clear",0.1,$39.00,$10.00,3,Office Supplies,Binders
AZ-2012-3985988,"Stanley Pencil Sharpener, Water Color",0,$112.00,$4.00,4,Office Supplies,Art
AZ-2012-3985988,"Acco Binder, Recycled",0,$124.00,$4.00,8,Office Supplies,Binders
AZ-2012-3985988,"Ames Peel and Seal, with clear poly window",0,$89.00,$41.00,4,Office Supplies,Envelopes
AZ-2012-3985988,"Advantus Rubber Bands, Bulk Pack",0,$17.00,$5.00,1,Office Supplies,Fasteners
AZ-2012-3985988,"Eldon Folders, Single Width",0.4,$31.00,$4.00,3,Office Supplies,Storage
AZ-2012-9624390,"Hon Bag Chairs, Adjustable",0,$333.00,$73.00,7,Furniture,Chairs
AZ-2012-9624390,"Okidata Inkjet, Wireless",0,"$2,199.00",$923.00,7,Technology,Machines
AZ-2012-3603258,"Stanley Markers, Easy-Erase",0,$22.00,$0.00,1,Office Supplies,Art
AZ-2012-3603258,"Smead Legal Exhibit Labels, Adjustable",0,$27.00,$4.00,3,Office Supplies,Labels
AZ-2012-5304566,"Smead Box, Wire Frame",0.1,$18.00,$1.00,2,Office Supplies,Storage
AZ-2012-5304566,"Apple Speaker Phone, Full Size",0,$125.00,$54.00,1,Technology,Phones
AZ-2012-5992799,"Hon Chairmat, Red",0.1,$150.00,$7.00,3,Furniture,Chairs
AZ-2012-5992799,"Okidata Inkjet, White",0,$623.00,$81.00,2,Technology,Machines
AZ-2012-8255780,"Smead Shelving, Single Width",0.1,$88.00,$34.00,2,Office Supplies,Storage
AZ-2012-6372701,"Wilson Jones Index Tab, Economy",0,$26.00,$7.00,4,Office Supplies,Binders
AZ-2012-6372701,"Fellowes File Cart, Blue",0.1,$247.00,$82.00,2,Office Supplies,Storage
AZ-2012-8255780,"Konica Phone, Red",0.15,$142.00,$45.00,2,Technology,Machines
AZ-2012-6372701,"Brother Copy Machine, Color",0.15,$673.00,$222.00,3,Technology,Copiers
BN-2012-702658,"Sanford Pencil Sharpener, Water Color",0.5,$15.00,-$11.00,1,Office Supplies,Art
AZ-2012-5235693,"Nokia Office Telephone, VoIP",0,$196.00,$72.00,3,Technology,Phones
AZ-2012-7930986,"Hon Executive Leather Armchair, Black",0.1,$823.00,$247.00,2,Furniture,Chairs
AZ-2012-7930986,"Fiskars Scissors, Steel",0.1,$284.00,$123.00,14,Office Supplies,Supplies
AZ-2012-1696586,"Wilson Jones 3-Hole Punch, Clear",0,$82.00,$23.00,3,Office Supplies,Binders
BN-2012-7504566,"Sanford Pencil Sharpener, Water Color",0.5,$39.00,-$19.00,3,Office Supplies,Art
AZ-2012-2224198,"Stockwell Paper Clips, Bulk Pack",0,$41.00,$20.00,3,Office Supplies,Fasteners
AZ-2012-2224198,"SanDisk Memory Card, Bluetooth",0,$225.00,$29.00,2,Technology,Accessories
AZ-2012-8940474,"Novimex Chairmat, Set of Two",0,$293.00,$47.00,5,Furniture,Chairs
AZ-2012-8940474,"Stanley Canvas, Easy-Erase",0,$99.00,$24.00,2,Office Supplies,Art
AZ-2012-2500695,"Kraft Business Envelopes, Set of 50",0,$60.00,$29.00,3,Office Supplies,Envelopes
AZ-2012-8940474,"Motorola Office Telephone, VoIP",0,$216.00,$95.00,3,Technology,Phones
AZ-2012-2500695,"Motorola Headset, Cordless",0.1,$446.00,$109.00,6,Technology,Phones
AZ-2012-3373330,"SAFCO Rocking Chair, Adjustable",0.2,$769.00,$154.00,7,Furniture,Chairs
AZ-2012-3373330,"Eldon Clock, Duo Pack",0.1,$153.00,$58.00,3,Furniture,Furnishings
AZ-2012-3373330,"Sanford Pens, Water Color",0.1,$64.00,$26.00,5,Office Supplies,Art
AZ-2012-3373330,"Avery Index Tab, Clear",0.1,$16.00,$3.00,3,Office Supplies,Binders
AZ-2012-3373330,"Ibico Index Tab, Clear",0.1,$56.00,$5.00,7,Office Supplies,Binders
AZ-2012-3373330,"Smead Folders, Wire Frame",0.2,$53.00,-$9.00,4,Office Supplies,Storage
BN-2012-8400051,"Hon Round Labels, Laser Printer Compatible",0.5,$3.00,-$1.00,1,Office Supplies,Labels
AZ-2012-1999567,"Fellowes Lockers, Single Width",0.1,$560.00,$44.00,3,Office Supplies,Storage
AZ-2012-3373330,"Brother Fax and Copier, Digital",0.1,$344.00,$15.00,2,Technology,Copiers
BN-2012-7073852,"Hon Rocking Chair, Red",0.2,$522.00,-$78.00,5,Furniture,Chairs
AZ-2012-4709370,"Ibico 3-Hole Punch, Economy",0,$91.00,$46.00,3,Office Supplies,Binders
AZ-2012-4709370,"OIC Thumb Tacks, Assorted Sizes",0,$35.00,$14.00,3,Office Supplies,Fasteners
AZ-2012-4709370,"Hon Shipping Labels, 5000 Label Set",0,$24.00,$11.00,2,Office Supplies,Labels
AZ-2012-4709370,"Tenex File Cart, Single Width",0.4,$241.00,-$125.00,3,Office Supplies,Storage
AZ-2012-1418024,"Ikea 3-Shelf Cabinet, Traditional",0,$712.00,$320.00,5,Furniture,Bookcases
AZ-2012-1418024,"Bevis Wood Table, Rectangular",0,"$1,062.00",$181.00,2,Furniture,Tables
AZ-2012-1418024,"Binney & Smith Canvas, Fluorescent",0,$158.00,$30.00,3,Office Supplies,Art
AZ-2012-1418024,"SanDisk Mouse, Bluetooth",0,$230.00,$25.00,6,Technology,Accessories
AZ-2012-1418024,"Nokia Headset, Cordless",0,$380.00,$84.00,5,Technology,Phones
AZ-2012-219498,"Binney & Smith Pencil Sharpener, Water Color",0,$269.00,$62.00,9,Office Supplies,Art
BN-2012-2362845,"Dania 3-Shelf Cabinet, Mobile",0.1,$907.00,-$30.00,7,Furniture,Bookcases
AZ-2012-364031,"Acco Binder, Economy",0,$30.00,$4.00,2,Office Supplies,Binders
AZ-2012-5139893,"Panasonic Inkjet, Durable",0.15,"$2,123.00",$125.00,8,Technology,Machines
AZ-2012-6962092,"Advantus Rubber Bands, Bulk Pack",0,$66.00,$22.00,4,Office Supplies,Fasteners
AZ-2012-6962092,"Smead Shelving, Blue",0,$147.00,$44.00,3,Office Supplies,Storage
AZ-2012-4686001,"Ames Peel and Seal, Security-Tint",0.1,$57.00,$13.00,3,Office Supplies,Envelopes
AZ-2012-4686001,"Stockwell Clamps, Assorted Sizes",0.1,$29.00,$8.00,2,Office Supplies,Fasteners
AZ-2012-9208057,"Cuisinart Refrigerator, Red",0,"$1,488.00",$372.00,3,Office Supplies,Appliances
AZ-2012-9208057,"Cameo Clasp Envelope, Security-Tint",0,$24.00,$6.00,2,Office Supplies,Envelopes
AZ-2012-9208057,"Tenex Box, Blue",0,$99.00,$25.00,6,Office Supplies,Storage
AZ-2012-2839783,"BIC Pencil Sharpener, Fluorescent",0.1,$27.00,$7.00,1,Office Supplies,Art
AZ-2012-2839783,"GlobeWeis Peel and Seal, with clear poly window",0.1,$45.00,-$3.00,2,Office Supplies,Envelopes
AZ-2012-2839783,"Xerox Message Books, Premium",0.1,$55.00,$22.00,3,Office Supplies,Paper
AZ-2012-9551282,"Sanford Markers, Easy-Erase",0,$165.00,$3.00,7,Office Supplies,Art
AZ-2012-9551282,"Stanley Sketch Pad, Fluorescent",0,$46.00,$7.00,1,Office Supplies,Art
AZ-2012-9551282,"Memorex Memory Card, Programmable",0,$519.00,$73.00,5,Technology,Accessories
AZ-2012-2413231,"Tenex Trays, Single Width",0.1,$98.00,$30.00,2,Office Supplies,Storage
AZ-2012-7806726,"Tenex Photo Frame, Erganomic",0,$353.00,$7.00,7,Furniture,Furnishings
AZ-2012-7806726,"BIC Sketch Pad, Easy-Erase",0,$343.00,$171.00,7,Office Supplies,Art
AZ-2012-3093353,"Harbour Creations Steel Folding Chair, Red",0.1,$352.00,$67.00,4,Furniture,Chairs
AZ-2012-3906554,"Harbour Creations Chairmat, Red",0.1,$518.00,$63.00,8,Furniture,Chairs
AZ-2012-1028247,"Hamilton Beach Stove, Red",0.1,"$1,952.00",$759.00,4,Office Supplies,Appliances
AZ-2012-3093353,"Wilson Jones Binder Covers, Recycled",0,$35.00,$8.00,3,Office Supplies,Binders
AZ-2012-3093353,"OIC Push Pins, Bulk Pack",0,$15.00,$3.00,1,Office Supplies,Fasteners
AZ-2012-3093353,"Avery Legal Exhibit Labels, Laser Printer Compatible",0,$23.00,$3.00,2,Office Supplies,Labels
AZ-2012-3981098,"Acco Binder, Durable",0,$33.00,$9.00,2,Office Supplies,Binders
AZ-2012-5060433,"Office Star Rocking Chair, Adjustable",0.1,$258.00,$75.00,2,Furniture,Chairs
AZ-2012-5060433,"Eldon Clock, Duo Pack",0,$226.00,$99.00,4,Furniture,Furnishings
AZ-2012-5060433,"Stiletto Letter Opener, Steel",0,$75.00,$9.00,3,Office Supplies,Supplies
BN-2012-3187159,"Sanford Canvas, Blue",0.5,$51.00,-$21.00,2,Office Supplies,Art
AZ-2012-9314178,"Cardinal Index Tab, Durable",0,$15.00,$7.00,2,Office Supplies,Binders
AZ-2012-2363041,"Stockwell Paper Clips, Bulk Pack",0.5,$14.00,-$1.00,2,Office Supplies,Fasteners
AZ-2012-8819621,"Samsung Signal Booster, VoIP",0.1,$246.00,$66.00,2,Technology,Phones
AZ-2012-3913480,"Eldon Frame, Durable",0,$906.00,$235.00,8,Furniture,Furnishings
AZ-2012-3913480,"Boston Canvas, Water Color",0,$398.00,$60.00,7,Office Supplies,Art
AZ-2012-3913480,"Cardinal Binding Machine, Clear",0,$345.00,$138.00,7,Office Supplies,Binders
AZ-2012-2425717,"Ibico Binder Covers, Durable",0,$30.00,$4.00,2,Office Supplies,Binders
AZ-2012-2425717,"Acme Scissors, Serrated",0,$66.00,$4.00,3,Office Supplies,Supplies
AZ-2012-6757655,"Stockwell Staples, 12 Pack",0,$20.00,$6.00,2,Office Supplies,Fasteners
AZ-2012-6757655,"Fellowes Folders, Wire Frame",0.1,$46.00,$8.00,2,Office Supplies,Storage
AZ-2012-6757655,"Tenex Shelving, Wire Frame",0.1,$242.00,$5.00,5,Office Supplies,Storage
BN-2012-3858400,"Wilson Jones Binding Machine, Recycled",0.5,$99.00,-$77.00,4,Office Supplies,Binders
BN-2012-3858400,"Hon Removable Labels, Adjustable",0.5,$12.00,-$9.00,3,Office Supplies,Labels
BN-2012-3858400,"Fiskars Trimmer, Serrated",0.5,$117.00,-$89.00,6,Office Supplies,Supplies
AZ-2012-5894854,"Acco Binding Machine, Durable",0,$316.00,$76.00,6,Office Supplies,Binders
AZ-2012-5894854,"Hon Shipping Labels, 5000 Label Set",0,$59.00,$28.00,5,Office Supplies,Labels
AZ-2012-5894854,"Smead Shipping Labels, 5000 Label Set",0,$24.00,$1.00,2,Office Supplies,Labels
AZ-2012-5894854,"Rogers Shelving, Industrial",0,$188.00,$56.00,3,Office Supplies,Storage
AZ-2012-5894854,"Acme Letter Opener, Serrated",0,$54.00,$4.00,2,Office Supplies,Supplies
AZ-2012-5894854,"Kleencut Ruler, Easy Grip",0,$46.00,$1.00,3,Office Supplies,Supplies
AZ-2012-8565263,"Okidata Inkjet, White",0,"$1,245.00",$162.00,4,Technology,Machines
AZ-2012-5117204,"Acco 3-Hole Punch, Economy",0.1,$54.00,$5.00,2,Office Supplies,Binders
BN-2012-5777866,"Hewlett Fax Machine, Laser",0.15,$816.00,-$96.00,3,Technology,Copiers
AZ-2012-5117204,"StarTech Inkjet, White",0.1,$807.00,$305.00,3,Technology,Machines
BN-2012-9869476,"Brother Wireless Fax, Digital",0,$757.00,$68.00,2,Technology,Copiers
BN-2012-9869476,"Motorola Audio Dock, Cordless",0.4,$211.00,-$49.00,2,Technology,Phones
BN-2012-1757975,"Harbour Creations Executive Leather Armchair, Black",0.1,$426.00,$90.00,1,Furniture,Chairs
BN-2012-2095072,"GlobeWeis Manila Envelope, Security-Tint",0,$89.00,$1.00,3,Office Supplies,Envelopes
BN-2012-2095072,"Kraft Peel and Seal, Set of 50",0,$41.00,$7.00,2,Office Supplies,Envelopes
BN-2012-2095072,"Rogers Lockers, Wire Frame",0.1,$758.00,$126.00,4,Office Supplies,Storage
AZ-2012-7448408,"Wilson Jones 3-Hole Punch, Durable",0.5,$15.00,-$9.00,1,Office Supplies,Binders
AZ-2012-7448408,"Kraft Clasp Envelope, Set of 50",0.5,$5.00,-$5.00,1,Office Supplies,Envelopes
AZ-2012-7448408,"Stockwell Push Pins, Metal",0.5,$22.00,-$21.00,3,Office Supplies,Fasteners
AZ-2012-3133492,"Harbour Creations Swivel Stool, Red",0.1,$486.00,$135.00,3,Furniture,Chairs
AZ-2012-3133492,"Avery Index Tab, Economy",0,$16.00,$6.00,2,Office Supplies,Binders
AZ-2012-3133492,"Stockwell Push Pins, Metal",0,$85.00,$5.00,6,Office Supplies,Fasteners
AZ-2012-3133492,"Samsung Headset, VoIP",0.15,$187.00,$59.00,3,Technology,Phones
AZ-2012-2918666,"Sauder Stackable Bookrack, Traditional",0,$293.00,$44.00,2,Furniture,Bookcases
AZ-2012-2918666,"Avery Binding Machine, Durable",0,$50.00,$3.00,1,Office Supplies,Binders
AZ-2012-2918666,"Xerox Memo Slips, Multicolor",0,$60.00,$2.00,4,Office Supplies,Paper
BN-2012-8357791,"Tenex Shelving, Blue",0.1,$98.00,-$5.00,2,Office Supplies,Storage
AZ-2012-3768744,"Wilson Jones Hole Reinforcements, Durable",0,$18.00,$6.00,3,Office Supplies,Binders
AZ-2012-3768744,"Stockwell Staples, Metal",0,$44.00,$17.00,4,Office Supplies,Fasteners
AZ-2012-3505985,"BIC Highlighters, Blue",0.1,$34.00,$11.00,2,Office Supplies,Art
AZ-2012-3505985,"Enermax Router, USB",0.1,$698.00,$62.00,3,Technology,Accessories
AZ-2012-3505985,"Apple Headset, VoIP",0.1,$330.00,$15.00,5,Technology,Phones
AZ-2012-3505985,"Apple Headset, with Caller ID",0.1,$330.00,$18.00,5,Technology,Phones
AZ-2012-9382192,"Eldon Photo Frame, Erganomic",0.5,$142.00,-$46.00,5,Furniture,Furnishings
BN-2012-4720977,"SAFCO Bag Chairs, Red",0.1,$44.00,-$1.00,1,Furniture,Chairs
BN-2012-4720977,"Boston Sketch Pad, Water Color",0,$259.00,$8.00,5,Office Supplies,Art
BN-2012-4720977,"Jiffy Business Envelopes, Set of 50",0,$20.00,$3.00,1,Office Supplies,Envelopes
BN-2012-4720977,"Smead Folders, Industrial",0.1,$97.00,$14.00,6,Office Supplies,Storage
BN-2012-4720977,"Tenex Lockers, Single Width",0.1,$735.00,-$33.00,4,Office Supplies,Storage
AZ-2012-6233786,"GlobeWeis Manila Envelope, Set of 50",0,$82.00,$27.00,3,Office Supplies,Envelopes
AZ-2012-6233786,"Panasonic Printer, Wireless",0.15,$680.00,$80.00,3,Technology,Machines
AZ-2012-6233786,"Apple Speaker Phone, Cordless",0.15,$536.00,$44.00,5,Technology,Phones
AZ-2012-7753558,"KitchenAid Stove, Silver",0,"$1,142.00",$411.00,2,Office Supplies,Appliances
AZ-2012-7753558,"Kraft Mailers, Set of 50",0,$113.00,$30.00,3,Office Supplies,Envelopes
AZ-2012-7753558,"Belkin Router, Erganomic",0,"$1,283.00",$603.00,5,Technology,Accessories
AZ-2012-909274,"Cisco Smart Phone, with Caller ID",0.1,"$2,944.00","$1,112.00",5,Technology,Phones
BN-2012-4476459,"Binney & Smith Sketch Pad, Easy-Erase",0,$93.00,$14.00,2,Office Supplies,Art
BN-2012-4476459,"Fellowes File Cart, Single Width",0.4,$412.00,-$275.00,5,Office Supplies,Storage
BN-2012-4476459,"Tenex Shelving, Blue",0.4,$98.00,-$57.00,3,Office Supplies,Storage
AZ-2012-6544927,"BIC Markers, Easy-Erase",0.1,$96.00,$19.00,4,Office Supplies,Art
AZ-2012-6544927,"Smead Lockers, Blue",0.1,"$1,071.00",$83.00,6,Office Supplies,Storage
AZ-2012-5862496,"Green Bar Parchment Paper, Recycled",0,$50.00,$23.00,3,Office Supplies,Paper
AZ-2012-5862496,"SanDisk Parchment Paper, Premium",0,$33.00,$6.00,2,Office Supplies,Paper
AZ-2012-5862496,"Fellowes Folders, Blue",0.1,$48.00,$21.00,2,Office Supplies,Storage
AZ-2012-5862496,"Rogers Trays, Blue",0.1,$167.00,$37.00,3,Office Supplies,Storage
AZ-2012-5862496,"Smead Shelving, Wire Frame",0.1,$130.00,$52.00,3,Office Supplies,Storage
AZ-2012-1021775,"Eldon Folders, Wire Frame",0,$48.00,$5.00,3,Office Supplies,Storage
AZ-2012-1759709,"Elite Ruler, Easy Grip",0,$46.00,$3.00,3,Office Supplies,Supplies
AZ-2012-7356615,"GlobeWeis Business Envelopes, Set of 50",0.1,$62.00,$12.00,4,Office Supplies,Envelopes
AZ-2012-7356615,"Accos Rubber Bands, Bulk Pack",0.1,$30.00,$13.00,2,Office Supplies,Fasteners
AZ-2012-7356615,"Green Bar Note Cards, Multicolor",0.1,$214.00,$73.00,7,Office Supplies,Paper
