Order ID,Product Name,Discount,Sales,Profit,Quantity,Category,Sub-Category
BN-2014-9271210,"Samsung Speaker Phone, with Caller ID",0.1,$333.00,-$15.00,3,Technology,Phones
BN-2014-4759297,"Hon Steel Folding Chair, Black",0.5,$158.00,-$63.00,4,Furniture,Chairs
BN-2014-8493925,"Eldon Light Bulb, Erganomic",0.6,$76.00,-$92.00,8,Furniture,Furnishings
BN-2014-4759297,"Wilson Jones Binder Covers, Economy",0.5,$11.00,-$5.00,2,Office Supplies,Binders
BN-2014-8493925,"Samsung Signal Booster, VoIP",0.5,$273.00,-$87.00,4,Technology,Phones
AZ-2014-9397794,"Eldon Light Bulb, Erganomic",0,$95.00,$11.00,4,Furniture,Furnishings
AZ-2014-9397794,"Smead Trays, Wire Frame",0.1,$128.00,$4.00,3,Office Supplies,Storage
AZ-2014-1833043,"Accos Rubber Bands, Bulk Pack",0,$117.00,$57.00,7,Office Supplies,Fasteners
AZ-2014-1592554,"Hon Bag Chairs, Red",0,$316.00,$104.00,7,Furniture,Chairs
AZ-2014-791703,"Bush Floating Shelf Set, Metal",0.5,$171.00,-$140.00,2,Furniture,Bookcases
AZ-2014-1592554,"Acme Box Cutter, High Speed",0,$113.00,$54.00,3,Office Supplies,Supplies
AZ-2014-791703,"Stockwell Thumb Tacks, Metal",0.5,$34.00,-$12.00,5,Office Supplies,Fasteners
AZ-2014-1592554,"SanDisk Keyboard, USB",0,$82.00,$7.00,1,Technology,Accessories
AZ-2014-8986990,"SAFCO Chairmat, Red",0.1,$269.00,$33.00,5,Furniture,Chairs
AZ-2014-8986990,"Novimex Color Coded Labels, Alphabetical",0,$24.00,$8.00,2,Office Supplies,Labels
AZ-2014-5973940,"Acco Binder, Economy",0,$30.00,$4.00,2,Office Supplies,Binders
BN-2014-7358344,"Belkin Memory Card, Bluetooth",0,$115.00,$25.00,1,Technology,Accessories
BN-2014-7358344,"Canon Copy Machine, Digital",0.15,$668.00,-$31.00,3,Technology,Copiers
AZ-2014-7046345,"Dania Stackable Bookrack, Pine",0.1,"$1,117.00",$447.00,10,Furniture,Bookcases
AZ-2014-7046345,"Rubbermaid Light Bulb, Durable",0.4,$29.00,$0.00,3,Furniture,Furnishings
AZ-2014-7046345,"Sanford Markers, Fluorescent",0.1,$66.00,$22.00,3,Office Supplies,Art
AZ-2014-5845365,"Stanley Markers, Water Color",0,$127.00,$42.00,5,Office Supplies,Art
AZ-2014-778430,"Sharp Personal Copier, Digital",0.15,$203.00,$84.00,2,Technology,Copiers
BN-2014-1468237,"KitchenAid Microwave, Red",0.1,$559.00,-$19.00,2,Office Supplies,Appliances
BN-2014-1468237,"Tenex Trays, Industrial",0.1,$148.00,$0.00,3,Office Supplies,Storage
BN-2014-1468237,"Memorex Router, Erganomic",0,$976.00,$293.00,4,Technology,Accessories
BN-2014-45288,"StarTech Calculator, Wireless",0.1,$144.00,-$7.00,4,Technology,Machines
AZ-2014-9634517,"Novimex Shipping Labels, Alphabetical",0,$22.00,$11.00,2,Office Supplies,Labels
AZ-2014-9634517,"Brother Fax and Copier, Color",0,"$1,543.00",$370.00,8,Technology,Copiers
AZ-2014-5960256,"Fellowes Lockers, Industrial",0.1,$374.00,$141.00,2,Office Supplies,Storage
AZ-2014-5960256,"Enermax Router, Erganomic",0,"$2,305.00",$922.00,9,Technology,Accessories
AZ-2014-1627961,"Avery File Folder Labels, 5000 Label Set",0,$29.00,$1.00,3,Office Supplies,Labels
AZ-2014-1627961,"Eldon File Cart, Single Width",0.1,$230.00,$20.00,2,Office Supplies,Storage
AZ-2014-1803267,"BIC Markers, Easy-Erase",0,$53.00,$15.00,2,Office Supplies,Art
BN-2014-3140940,"Rogers Folders, Blue",0.6,$37.00,-$53.00,3,Office Supplies,Storage
AZ-2014-8880439,"Enermax Memo Slips, Premium",0,$63.00,$1.00,4,Office Supplies,Paper
AZ-2014-6878748,"Elite Trimmer, Easy Grip",0,$130.00,$61.00,3,Office Supplies,Supplies
BN-2014-1489324,"Stanley Markers, Blue",0.5,$78.00,-$64.00,7,Office Supplies,Art
BN-2014-1489324,"Rogers Lockers, Wire Frame",0.5,$632.00,-$316.00,6,Office Supplies,Storage
AZ-2014-6301419,"Ikea Stackable Bookrack, Mobile",0.1,$450.00,$190.00,4,Furniture,Bookcases
AZ-2014-6301419,"Ibico Index Tab, Clear",0,$62.00,$11.00,7,Office Supplies,Binders
AZ-2014-6301419,"Avery Removable Labels, Adjustable",0,$17.00,$8.00,2,Office Supplies,Labels
AZ-2014-8480616,"Eldon Light Bulb, Duo Pack",0,$25.00,$10.00,1,Furniture,Furnishings
AZ-2014-2733980,"Advantus Thumb Tacks, 12 Pack",0,$78.00,$3.00,6,Office Supplies,Fasteners
AZ-2014-2733980,"SanDisk Message Books, Recycled",0,$47.00,$21.00,2,Office Supplies,Paper
AZ-2014-8480616,"Enermax Mouse, USB",0,$122.00,$15.00,3,Technology,Accessories
AZ-2014-2733980,"Sharp Personal Copier, High-Speed",0,$473.00,$194.00,4,Technology,Copiers
BN-2014-9778057,"Office Star Swivel Stool, Adjustable",0.1,$476.00,$0.00,3,Furniture,Chairs
BN-2014-9778057,"Ibico Binding Machine, Economy",0,$257.00,$23.00,5,Office Supplies,Binders
AZ-2014-7453944,"BIC Highlighters, Water Color",0,$44.00,$8.00,2,Office Supplies,Art
AZ-2014-1007120,"Dania Classic Bookcase, Traditional",0,"$1,232.00",$530.00,3,Furniture,Bookcases
AZ-2014-1007120,"Deflect-O Frame, Black",0,$990.00,$436.00,9,Furniture,Furnishings
BN-2014-4920125,"Epson Calculator, Wireless",0.5,$46.00,$0.00,2,Technology,Machines
AZ-2014-3159501,"Rubbermaid Clock, Durable",0,$94.00,$34.00,2,Furniture,Furnishings
AZ-2014-5426715,"Enermax Message Books, Multicolor",0,$120.00,$6.00,5,Office Supplies,Paper
BN-2014-1655185,"Ibico Binder, Recycled",0.5,$40.00,-$33.00,5,Office Supplies,Binders
AZ-2014-8489186,"Novimex Steel Folding Chair, Red",0.1,$148.00,$54.00,2,Furniture,Chairs
AZ-2014-7725232,"Stanley Sketch Pad, Water Color",0,$571.00,$108.00,12,Office Supplies,Art
AZ-2014-7725232,"Cardinal Binding Machine, Economy",0,$398.00,$111.00,8,Office Supplies,Binders
AZ-2014-7725232,"Acme Box Cutter, Easy Grip",0,$79.00,$39.00,2,Office Supplies,Supplies
BN-2014-6460657,"Boston Canvas, Easy-Erase",0.5,$27.00,-$15.00,1,Office Supplies,Art
BN-2014-6460657,"Fellowes Trays, Blue",0.5,$143.00,-$124.00,5,Office Supplies,Storage
BN-2014-6460657,"Smead Folders, Single Width",0.5,$44.00,-$17.00,5,Office Supplies,Storage
BN-2014-6460657,"Elite Scissors, High Speed",0.5,$45.00,-$2.00,4,Office Supplies,Supplies
AZ-2014-3540181,"Rubbermaid Stacking Tray, Erganomic",0,$71.00,$23.00,3,Furniture,Furnishings
AZ-2014-1568727,"Smead Shelving, Industrial",0.1,$89.00,$14.00,2,Office Supplies,Storage
AZ-2014-3540181,"Wilson Jones Hole Reinforcements, Clear",0,$16.00,$2.00,4,Office Supplies,Binders
AZ-2014-4295830,"Office Star Rocking Chair, Black",0.1,$374.00,$42.00,3,Furniture,Chairs
AZ-2014-6158544,"Boston Highlighters, Fluorescent",0,$40.00,$10.00,2,Office Supplies,Art
BN-2014-2570912,"Smead Lockers, Wire Frame",0.1,$355.00,-$4.00,2,Office Supplies,Storage
AZ-2014-2583309,"Rogers Folders, Wire Frame",0.1,$54.00,$1.00,2,Office Supplies,Storage
AZ-2014-9676120,"Binney & Smith Canvas, Easy-Erase",0,$155.00,$26.00,3,Office Supplies,Art
BN-2014-1507316,"Rogers Shelving, Wire Frame",0.4,$37.00,-$6.00,1,Office Supplies,Storage
BN-2014-1507316,"Memorex Mouse, Bluetooth",0,$28.00,$1.00,1,Technology,Accessories
BN-2014-5698928,"Enermax Computer Printout Paper, 8.5 x 11",0.5,$82.00,-$39.00,5,Office Supplies,Paper
AZ-2014-5299088,"Eaton Parchment Paper, 8.5 x 11",0,$53.00,$11.00,3,Office Supplies,Paper
BN-2014-5698928,"Motorola Signal Booster, Full Size",0.5,$72.00,-$49.00,1,Technology,Phones
AZ-2014-5958487,"BIC Markers, Blue",0,$106.00,$2.00,4,Office Supplies,Art
BN-2014-8459769,"Hewlett Copy Machine, Color",0.5,$133.00,-$42.00,1,Technology,Copiers
AZ-2014-8562932,"Stanley Highlighters, Blue",0,$103.00,$21.00,7,Office Supplies,Art
AZ-2014-7679425,"Sanford Sketch Pad, Water Color",0,$341.00,$160.00,7,Office Supplies,Art
AZ-2014-7679425,"Fellowes Lockers, Single Width",0.1,$560.00,$44.00,3,Office Supplies,Storage
AZ-2014-7679425,"Stiletto Letter Opener, Easy Grip",0,$57.00,$27.00,2,Office Supplies,Supplies
AZ-2014-4524252,"Smead Lockers, Wire Frame",0,$987.00,$89.00,5,Office Supplies,Storage
AZ-2014-1769606,"Stanley Pencil Sharpener, Water Color",0,$28.00,$1.00,1,Office Supplies,Art
AZ-2014-1769606,"Accos Rubber Bands, Assorted Sizes",0,$71.00,$16.00,5,Office Supplies,Fasteners
AZ-2014-6407661,"Advantus Clamps, Assorted Sizes",0.1,$75.00,$2.00,5,Office Supplies,Fasteners
AZ-2014-3040435,"Acco Binder Covers, Clear",0,$89.00,$38.00,7,Office Supplies,Binders
AZ-2014-3040435,"Ibico Index Tab, Economy",0,$42.00,$14.00,4,Office Supplies,Binders
AZ-2014-3040435,"Kraft Interoffice Envelope, Set of 50",0,$188.00,$41.00,4,Office Supplies,Envelopes
AZ-2014-3040435,"Eldon Lockers, Industrial",0.4,$595.00,$89.00,5,Office Supplies,Storage
AZ-2014-3040435,"Rogers Shelving, Industrial",0.4,$38.00,-$6.00,1,Office Supplies,Storage
AZ-2014-1861968,"KitchenAid Toaster, Silver",0.1,$232.00,$85.00,3,Office Supplies,Appliances
AZ-2014-1861968,"Eldon Shelving, Single Width",0.1,$174.00,-$19.00,4,Office Supplies,Storage
AZ-2014-6630320,"Elite Ruler, Easy Grip",0,$15.00,$1.00,1,Office Supplies,Supplies
AZ-2014-2291964,"Avery Hole Reinforcements, Clear",0.1,$10.00,$0.00,3,Office Supplies,Binders
AZ-2014-2291964,"Ibico Index Tab, Economy",0.1,$28.00,$7.00,3,Office Supplies,Binders
AZ-2014-2291964,"OIC Paper Clips, Bulk Pack",0.1,$39.00,$17.00,3,Office Supplies,Fasteners
AZ-2014-2291964,"Tenex File Cart, Industrial",0.2,$322.00,-$4.00,3,Office Supplies,Storage
AZ-2014-2291964,"Sharp Fax and Copier, High-Speed",0.1,$150.00,$3.00,1,Technology,Copiers
AZ-2014-462189,"Konica Inkjet, Wireless",0.1,$846.00,$56.00,3,Technology,Machines
AZ-2014-8951189,"Accos Thumb Tacks, 12 Pack",0,$26.00,$9.00,2,Office Supplies,Fasteners
AZ-2014-5567456,"Ibico Binding Machine, Durable",0,$159.00,$73.00,3,Office Supplies,Binders
AZ-2014-5567456,"Kleencut Shears, High Speed",0,$187.00,$80.00,4,Office Supplies,Supplies
AZ-2014-5567456,"Canon Fax and Copier, Laser",0,$191.00,$90.00,1,Technology,Copiers
AZ-2014-1556718,"HP Wireless Fax, Digital",0,"$2,519.00","$1,033.00",7,Technology,Copiers
AZ-2014-9904920,"HP Personal Copier, Color",0.15,$321.00,$26.00,3,Technology,Copiers
BN-2014-3985726,"Hon Rocking Chair, Set of Two",0.5,$133.00,-$56.00,2,Furniture,Chairs
AZ-2014-8467172,"Sauder Corner Shelving, Pine",0,$595.00,$119.00,4,Furniture,Bookcases
BN-2014-3985726,"Binney & Smith Pencil Sharpener, Fluorescent",0.5,$40.00,-$37.00,3,Office Supplies,Art
BN-2014-3985726,"Novimex Round Labels, 5000 Label Set",0.5,$7.00,$0.00,2,Office Supplies,Labels
AZ-2014-8467172,"Acco 3-Hole Punch, Economy",0,$151.00,$29.00,5,Office Supplies,Binders
AZ-2014-8467172,"Cardinal 3-Hole Punch, Recycled",0,$58.00,$17.00,2,Office Supplies,Binders
AZ-2014-8899652,"Wilson Jones Index Tab, Clear",0,$24.00,$2.00,4,Office Supplies,Binders
AZ-2014-5901455,"BIC Highlighters, Blue",0.1,$51.00,$17.00,3,Office Supplies,Art
AZ-2014-756508,"Avery Binder Covers, Durable",0,$88.00,$11.00,7,Office Supplies,Binders
AZ-2014-756508,"Harbour Creations File Folder Labels, Laser Printer Compatible",0,$79.00,$24.00,9,Office Supplies,Labels
AZ-2014-5901455,"SanDisk Flash Drive, Bluetooth",0.1,$71.00,$28.00,2,Technology,Accessories
BN-2014-2450854,"Ames Mailers, Recycled",0.5,$69.00,-$67.00,4,Office Supplies,Envelopes
BN-2014-2450854,"Green Bar Memo Slips, Premium",0.5,$59.00,-$46.00,7,Office Supplies,Paper
AZ-2014-6041399,"Novimex File Folder Labels, 5000 Label Set",0,$9.00,$3.00,1,Office Supplies,Labels
AZ-2014-2367501,"Acme Scissors, Serrated",0,$177.00,$11.00,8,Office Supplies,Supplies
AZ-2014-1948946,"Fiskars Box Cutter, Serrated",0,$97.00,$31.00,3,Office Supplies,Supplies
BN-2014-7160254,"Tenex Shelving, Industrial",0.5,$110.00,-$68.00,4,Office Supplies,Storage
AZ-2014-5084567,"Stockwell Clamps, Bulk Pack",0,$19.00,$4.00,1,Office Supplies,Fasteners
AZ-2014-5084567,"Belkin Flash Drive, Programmable",0,$130.00,$13.00,3,Technology,Accessories
AZ-2014-4414949,"Avery Binder Covers, Clear",0,$21.00,$5.00,2,Office Supplies,Binders
AZ-2014-4414949,"Fiskars Scissors, High Speed",0,$93.00,$44.00,4,Office Supplies,Supplies
BN-2014-7390420,"Enermax Memory Card, Erganomic",0.5,$168.00,-$10.00,3,Technology,Accessories
BN-2014-8871614,"Boston Markers, Blue",0.5,$40.00,-$7.00,3,Office Supplies,Art
BN-2014-8871614,"Green Bar Memo Slips, Recycled",0.5,$34.00,-$22.00,4,Office Supplies,Paper
AZ-2014-1474181,"Binney & Smith Canvas, Fluorescent",0.1,$142.00,$14.00,3,Office Supplies,Art
AZ-2014-1474181,"Sanford Markers, Easy-Erase",0.1,$64.00,-$6.00,3,Office Supplies,Art
AZ-2014-1474181,"Avery Binder Covers, Durable",0.1,$45.00,$1.00,4,Office Supplies,Binders
AZ-2014-1474181,"Novimex Shipping Labels, Adjustable",0.1,$56.00,$5.00,7,Office Supplies,Labels
AZ-2014-1474181,"Green Bar Computer Printout Paper, Recycled",0.1,$53.00,-$1.00,2,Office Supplies,Paper
AZ-2014-1474181,"Green Bar Parchment Paper, Recycled",0.1,$60.00,$24.00,4,Office Supplies,Paper
BN-2014-3013563,"Ikea Floating Shelf Set, Traditional",0.6,$204.00,-$276.00,3,Furniture,Bookcases
BN-2014-3013563,"Ikea Library with Doors, Pine",0.6,$729.00,-$492.00,5,Furniture,Bookcases
BN-2014-3013563,"Advantus Push Pins, Bulk Pack",0.5,$29.00,-$24.00,4,Office Supplies,Fasteners
BN-2014-3013563,"Hon File Folder Labels, Laser Printer Compatible",0.5,$17.00,-$13.00,4,Office Supplies,Labels
AZ-2014-526283,"Stanley Canvas, Blue",0,$148.00,$24.00,3,Office Supplies,Art
AZ-2014-526283,"Panasonic Receipt Printer, Durable",0.4,$73.00,$5.00,1,Technology,Machines
AZ-2014-2981657,"Novimex Rocking Chair, Black",0,"$1,032.00",$124.00,8,Furniture,Chairs
AZ-2014-6031845,"Hoover Refrigerator, Black",0.1,"$2,366.00",$552.00,5,Office Supplies,Appliances
AZ-2014-2981657,"Okidata Printer, White",0,"$1,601.00",$16.00,6,Technology,Machines
AZ-2014-1114768,"Stanley Highlighters, Fluorescent",0,$32.00,$12.00,2,Office Supplies,Art
AZ-2014-1114768,"Eldon File Cart, Single Width",0.1,$230.00,$20.00,2,Office Supplies,Storage
AZ-2014-1114768,"Fellowes File Cart, Industrial",0.1,$744.00,$25.00,6,Office Supplies,Storage
AZ-2014-9380952,"Stanley Canvas, Easy-Erase",0,$199.00,$48.00,4,Office Supplies,Art
AZ-2014-9380952,"Stanley Pencil Sharpener, Fluorescent",0,$149.00,$48.00,6,Office Supplies,Art
AZ-2014-9380952,"Wilson Jones Binding Machine, Clear",0,$436.00,$131.00,9,Office Supplies,Binders
AZ-2014-6019807,"Novimex Executive Leather Armchair, Red",0.1,$828.00,$230.00,2,Furniture,Chairs
AZ-2014-6019807,"Enermax Parchment Paper, Multicolor",0,$34.00,$10.00,2,Office Supplies,Paper
AZ-2014-6019807,"Stiletto Box Cutter, High Speed",0,$72.00,$16.00,2,Office Supplies,Supplies
AZ-2014-6019807,"SanDisk Keyboard, Bluetooth",0,$489.00,$142.00,6,Technology,Accessories
AZ-2014-6019807,"Hewlett Ink, Laser",0.15,$379.00,-$13.00,3,Technology,Copiers
AZ-2014-2816978,"Smead Legal Exhibit Labels, Laser Printer Compatible",0.1,$30.00,-$1.00,3,Office Supplies,Labels
AZ-2014-8090546,"Harbour Creations Bag Chairs, Adjustable",0.1,$173.00,$69.00,3,Furniture,Chairs
BN-2014-3618473,"Fellowes Lockers, Industrial",0.5,$208.00,-$25.00,2,Office Supplies,Storage
AZ-2014-2658996,"Wilson Jones 3-Hole Punch, Economy",0,$140.00,$46.00,5,Office Supplies,Binders
AZ-2014-2510582,"Rogers File Cart, Single Width",0.1,$892.00,$159.00,7,Office Supplies,Storage
AZ-2014-9905195,"Green Bar Computer Printout Paper, Multicolor",0,$156.00,$36.00,5,Office Supplies,Paper
AZ-2014-2478728,"Sanford Pencil Sharpener, Fluorescent",0,$77.00,$27.00,3,Office Supplies,Art
AZ-2014-2478728,"Ibico Binder Covers, Economy",0,$27.00,$4.00,2,Office Supplies,Binders
AZ-2014-2478728,"Ibico Binder, Recycled",0,$32.00,$3.00,2,Office Supplies,Binders
AZ-2014-2215737,"Eldon Shelving, Blue",0,$242.00,$65.00,5,Office Supplies,Storage
AZ-2014-77046,"SanDisk Cards & Envelopes, Recycled",0,$193.00,$8.00,4,Office Supplies,Paper
AZ-2014-6235976,"Cuisinart Refrigerator, Black",0,"$1,487.00",$624.00,3,Office Supplies,Appliances
AZ-2014-6429468,"Ibico Binding Machine, Economy",0,$206.00,$18.00,4,Office Supplies,Binders
AZ-2014-6429468,"Canon Ink, Laser",0,$736.00,$346.00,5,Technology,Copiers
BN-2014-2557638,"Ikea Stackable Bookrack, Mobile",0,$375.00,$180.00,3,Furniture,Bookcases
BN-2014-2557638,"Sauder Stackable Bookrack, Pine",0,$299.00,$113.00,2,Furniture,Bookcases
BN-2014-2557638,"SAFCO Chairmat, Red",0.6,$287.00,-$280.00,12,Furniture,Chairs
BN-2014-2557638,"Advantus Frame, Erganomic",0,$110.00,$35.00,1,Furniture,Furnishings
BN-2014-2557638,"Cardinal Binding Machine, Clear",0,$148.00,$59.00,3,Office Supplies,Binders
BN-2014-2557638,"Sharp Fax Machine, Laser",0,"$1,183.00",$106.00,4,Technology,Copiers
AZ-2014-6710580,"BIC Highlighters, Easy-Erase",0,$38.00,$9.00,2,Office Supplies,Art
AZ-2014-7247090,"Novimex Rocking Chair, Red",0.2,$315.00,-$8.00,3,Furniture,Chairs
AZ-2014-7247090,"Ibico 3-Hole Punch, Durable",0,$128.00,$47.00,4,Office Supplies,Binders
AZ-2014-9550736,"Cuisinart Blender, White",0.1,$117.00,$36.00,2,Office Supplies,Appliances
AZ-2014-9550736,"Cisco Office Telephone, Cordless",0,$916.00,$192.00,11,Technology,Phones
AZ-2014-6427379,"Xerox Memo Slips, Recycled",0,$54.00,$8.00,4,Office Supplies,Paper
AZ-2014-8568021,"Green Bar Memo Slips, Premium",0,$102.00,$11.00,6,Office Supplies,Paper
AZ-2014-8128242,"Binney & Smith Markers, Blue",0,$120.00,$23.00,5,Office Supplies,Art
AZ-2014-8128242,"SanDisk Flash Drive, Bluetooth",0,$40.00,$18.00,1,Technology,Accessories
AZ-2014-4220771,"Bevis Round Table, with Bottom Storage",0.1,"$1,399.00",$109.00,3,Furniture,Tables
AZ-2014-3247933,"Stanley Canvas, Fluorescent",0,$101.00,$32.00,2,Office Supplies,Art
AZ-2014-1406790,"Memorex Flash Drive, Bluetooth",0,$118.00,$25.00,4,Technology,Accessories
AZ-2014-8154802,"Advantus Stacking Tray, Black",0.2,$190.00,$19.00,9,Furniture,Furnishings
AZ-2014-8154802,"Acco 3-Hole Punch, Durable",0.5,$158.00,-$29.00,10,Office Supplies,Binders
AZ-2014-8154802,"Tenex Trays, Single Width",0.5,$136.00,-$33.00,5,Office Supplies,Storage
AZ-2014-325624,"Office Star Chairmat, Adjustable",0.1,$184.00,$59.00,3,Furniture,Chairs
AZ-2014-325624,"BIC Highlighters, Blue",0,$38.00,$15.00,2,Office Supplies,Art
AZ-2014-325624,"Boston Markers, Easy-Erase",0,$53.00,$5.00,2,Office Supplies,Art
AZ-2014-325624,"Kraft Business Envelopes, Recycled",0,$38.00,$18.00,2,Office Supplies,Envelopes
AZ-2014-325624,"OIC Push Pins, 12 Pack",0,$43.00,$18.00,3,Office Supplies,Fasteners
AZ-2014-325624,"Canon Fax and Copier, Digital",0,$764.00,$84.00,4,Technology,Copiers
AZ-2014-9876866,"BIC Markers, Water Color",0,$59.00,$21.00,2,Office Supplies,Art
AZ-2014-9876866,"Acco Binding Machine, Durable",0,$210.00,$50.00,4,Office Supplies,Binders
AZ-2014-9876866,"Cardinal Binding Machine, Durable",0,$154.00,$54.00,3,Office Supplies,Binders
AZ-2014-9876866,"Ibico Binding Machine, Durable",0,$53.00,$24.00,1,Office Supplies,Binders
AZ-2014-9876866,"Ibico Hole Reinforcements, Clear",0,$26.00,$10.00,4,Office Supplies,Binders
AZ-2014-9876866,"Fellowes Lockers, Blue",0.1,"$1,120.00",$199.00,6,Office Supplies,Storage
AZ-2014-9876866,"Stiletto Ruler, High Speed",0,$45.00,$6.00,3,Office Supplies,Supplies
AZ-2014-9876866,"Memorex Memory Card, USB",0,$307.00,$74.00,3,Technology,Accessories
AZ-2014-5202108,"Eldon Box, Industrial",0.1,$19.00,$6.00,2,Office Supplies,Storage
AZ-2014-5202108,"Tenex Lockers, Industrial",0.1,$184.00,$37.00,1,Office Supplies,Storage
AZ-2014-6950700,"Canon Ink, High-Speed",0,$291.00,$93.00,2,Technology,Copiers
AZ-2014-6626996,"SanDisk Router, Programmable",0,$774.00,$170.00,3,Technology,Accessories
AZ-2014-5335130,"Advantus Paper Clips, Assorted Sizes",0,$80.00,$12.00,7,Office Supplies,Fasteners
BN-2014-5799987,"BIC Sketch Pad, Fluorescent",0.5,$75.00,-$25.00,3,Office Supplies,Art
BN-2014-5799987,"Sanford Pens, Blue",0.5,$17.00,-$9.00,3,Office Supplies,Art
AZ-2014-2853843,"Boston Sketch Pad, Blue",0,$194.00,$84.00,4,Office Supplies,Art
AZ-2014-1308209,"Boston Pens, Blue",0,$43.00,$1.00,3,Office Supplies,Art
AZ-2014-1308209,"Eldon File Cart, Single Width",0.1,$809.00,$296.00,7,Office Supplies,Storage
AZ-2014-221897,"Stockwell Rubber Bands, Metal",0,$50.00,$24.00,3,Office Supplies,Fasteners
AZ-2014-6883963,"Eldon Door Stop, Erganomic",0,$341.00,$44.00,7,Furniture,Furnishings
AZ-2014-1043314,"Eldon Light Bulb, Erganomic",0,$48.00,$6.00,2,Furniture,Furnishings
AZ-2014-6883963,"Binney & Smith Markers, Easy-Erase",0,$171.00,$68.00,7,Office Supplies,Art
AZ-2014-1043314,"Wilson Jones Binder, Durable",0,$29.00,$1.00,2,Office Supplies,Binders
AZ-2014-1043314,"Novimex Legal Exhibit Labels, 5000 Label Set",0,$22.00,$3.00,2,Office Supplies,Labels
AZ-2014-4789346,"Rubbermaid Clock, Duo Pack",0,$100.00,$16.00,2,Furniture,Furnishings
AZ-2014-5829110,"Smead Lockers, Single Width",0.1,"$1,429.00",$555.00,8,Office Supplies,Storage
AZ-2014-5829110,"Smead Shelving, Blue",0.1,$88.00,$20.00,2,Office Supplies,Storage
AZ-2014-5688152,"Jiffy Interoffice Envelope, Recycled",0,$271.00,$73.00,6,Office Supplies,Envelopes
AZ-2014-5688152,"Smead Trays, Single Width",0,$49.00,$16.00,1,Office Supplies,Storage
AZ-2014-6597356,"Safco Floating Shelf Set, Pine",0,$594.00,$89.00,3,Furniture,Bookcases
AZ-2014-9952627,"Cuisinart Stove, White",0,$536.00,$91.00,1,Office Supplies,Appliances
AZ-2014-9952627,"Elite Letter Opener, Easy Grip",0,$137.00,$5.00,5,Office Supplies,Supplies
AZ-2014-9952627,"Canon Wireless Fax, Laser",0,$757.00,$371.00,2,Technology,Copiers
AZ-2014-7447666,"Chromcraft Conference Table, with Bottom Storage",0,"$4,363.00",$305.00,5,Furniture,Tables
AZ-2014-6650288,"Cameo Clasp Envelope, with clear poly window",0,$78.00,$28.00,6,Office Supplies,Envelopes
AZ-2014-7447666,"Samsung Signal Booster, Full Size",0,$414.00,$199.00,3,Technology,Phones
AZ-2014-9821147,"Kraft Clasp Envelope, Set of 50",0,$36.00,$0.00,4,Office Supplies,Envelopes
AZ-2014-4255691,"Rogers Trays, Blue",0.1,$333.00,$74.00,6,Office Supplies,Storage
AZ-2014-4255691,"Fiskars Shears, High Speed",0,$238.00,$117.00,5,Office Supplies,Supplies
AZ-2014-8916168,"Advantus Push Pins, Assorted Sizes",0,$36.00,$7.00,3,Office Supplies,Fasteners
AZ-2014-2413956,"Ames Business Envelopes, Recycled",0,$67.00,$26.00,5,Office Supplies,Envelopes
AZ-2014-8687924,"BIC Sketch Pad, Easy-Erase",0,$147.00,$73.00,3,Office Supplies,Art
AZ-2014-8687924,"Xerox Memo Slips, 8.5 x 11",0,$53.00,$5.00,3,Office Supplies,Paper
AZ-2014-8687924,"Okidata Phone, White",0,$171.00,$2.00,2,Technology,Machines
AZ-2014-6714214,"Elite Ruler, Serrated",0,$32.00,$6.00,3,Office Supplies,Supplies
AZ-2014-8536659,"Apple Signal Booster, Cordless",0,$977.00,$244.00,7,Technology,Phones
AZ-2014-2446526,"Rogers Shelving, Wire Frame",0.1,$55.00,$13.00,1,Office Supplies,Storage
AZ-2014-2446526,"Panasonic Calculator, Durable",0.1,$181.00,$8.00,4,Technology,Machines
AZ-2014-2805092,"Office Star Executive Leather Armchair, Black",0.1,"$1,683.00",-$56.00,4,Furniture,Chairs
AZ-2014-2805092,"Fellowes Lockers, Wire Frame",0.1,$557.00,$217.00,3,Office Supplies,Storage
AZ-2014-208875,"Ikea Stackable Bookrack, Mobile",0,$876.00,$420.00,7,Furniture,Bookcases
AZ-2014-208875,"Tenex Light Bulb, Black",0,$19.00,$6.00,1,Furniture,Furnishings
AZ-2014-208875,"Stanley Sketch Pad, Easy-Erase",0,$134.00,$25.00,3,Office Supplies,Art
AZ-2014-208875,"Tenex Trays, Single Width",0.4,$98.00,-$3.00,3,Office Supplies,Storage
AZ-2014-9423386,"Acco Binder Covers, Clear",0,$26.00,$11.00,2,Office Supplies,Binders
AZ-2014-9423386,"Eldon Box, Wire Frame",0,$19.00,$6.00,2,Office Supplies,Storage
AZ-2014-9423386,"Brother Fax and Copier, Color",0,$579.00,$139.00,3,Technology,Copiers
AZ-2014-7702774,"Binney & Smith Pencil Sharpener, Fluorescent",0,$27.00,$1.00,1,Office Supplies,Art
AZ-2014-7702774,"Sanford Markers, Fluorescent",0,$74.00,$29.00,3,Office Supplies,Art
AZ-2014-7702774,"Xerox Cards & Envelopes, Premium",0,$180.00,$54.00,4,Office Supplies,Paper
AZ-2014-7702774,"Okidata Inkjet, Durable",0.15,"$1,063.00",-$175.00,4,Technology,Machines
AZ-2014-7893156,"Ikea Library with Doors, Metal",0.5,$544.00,-$152.00,3,Furniture,Bookcases
AZ-2014-8101198,"Bush Classic Bookcase, Metal",0.1,$742.00,$198.00,2,Furniture,Bookcases
AZ-2014-8101198,"Wilson Jones Hole Reinforcements, Clear",0.1,$14.00,$0.00,4,Office Supplies,Binders
AZ-2014-8101198,"Harbour Creations Legal Exhibit Labels, Alphabetical",0.1,$87.00,$32.00,9,Office Supplies,Labels
AZ-2014-1805424,"Ibico Hole Reinforcements, Recycled",0,$22.00,$7.00,3,Office Supplies,Binders
AZ-2014-1805424,"Smead Legal Exhibit Labels, 5000 Label Set",0,$34.00,$6.00,3,Office Supplies,Labels
AZ-2014-8101198,"Epson Printer, Red",0.1,$935.00,$114.00,4,Technology,Machines
AZ-2014-6526295,"Eldon Trays, Single Width",0.1,$43.00,$11.00,1,Office Supplies,Storage
AZ-2014-2857176,"KitchenAid Toaster, White",0,$250.00,$100.00,3,Office Supplies,Appliances
AZ-2014-2857176,"Kleencut Scissors, Serrated",0,$57.00,$5.00,3,Office Supplies,Supplies
AZ-2014-1353698,"Cardinal Binding Machine, Durable",0,$461.00,$161.00,9,Office Supplies,Binders
AZ-2014-1466197,"KitchenAid Blender, Silver",0.1,$267.00,$74.00,3,Office Supplies,Appliances
AZ-2014-1466197,"Avery Shipping Labels, 5000 Label Set",0,$61.00,$23.00,5,Office Supplies,Labels
AZ-2014-2277609,"Eldon File Cart, Industrial",0.1,$806.00,$18.00,7,Office Supplies,Storage
AZ-2014-1466197,"Logitech Mouse, Bluetooth",0,$146.00,$66.00,5,Technology,Accessories
AZ-2014-2277609,"Enermax Keyboard, Erganomic",0,$163.00,$81.00,2,Technology,Accessories
AZ-2014-2277609,"Panasonic Inkjet, Wireless",0,$624.00,$44.00,2,Technology,Machines
AZ-2014-6552559,"BIC Markers, Fluorescent",0,$138.00,$11.00,5,Office Supplies,Art
AZ-2014-6552559,"BIC Sketch Pad, Water Color",0,$156.00,$23.00,3,Office Supplies,Art
AZ-2014-6552559,"Konica Inkjet, White",0.1,$559.00,$174.00,2,Technology,Machines
AZ-2014-9575428,"Advantus Stacking Tray, Durable",0,$264.00,$71.00,10,Furniture,Furnishings
AZ-2014-9575428,"Deflect-O Photo Frame, Durable",0,$147.00,$21.00,3,Furniture,Furnishings
AZ-2014-6764855,"Binney & Smith Markers, Water Color",0,$27.00,$5.00,1,Office Supplies,Art
AZ-2014-6764855,"Wilson Jones Hole Reinforcements, Clear",0,$32.00,$3.00,8,Office Supplies,Binders
AZ-2014-6764855,"Smead Color Coded Labels, Adjustable",0,$55.00,$12.00,5,Office Supplies,Labels
AZ-2014-9575428,"Acco Hole Reinforcements, Durable",0,$16.00,$8.00,2,Office Supplies,Binders
